Symbol,Name,Last Sale,Net Change,% Change,Market Cap,Country,IPO Year,Volume,Sector,Industry
AAMC,Altisource Asset Management Corp Com,$17.20,-0.10,-0.578%,35231087.00,United States,,1086,Finance,Investment Managers
AAU,Almaden Minerals Ltd. Common Shares,$0.5504,-0.0027,-0.488%,75526663.00,Canada,2015,94113,,
ACU,Acme United Corporation. Common Stock,$45.02,0.13,0.29%,150466294.00,United States,1988,9739,Consumer Durables,Home Furnishings
ACY,AeroCentury Corp. Common Stock,$9.0369,-0.0531,-0.584%,13969999.00,United States,,49897,Technology,Diversified Commercial Services
ADRA,Adara Acquisition Corp. Class A Common Stock,$9.78,0.00,0.00%,140587500.00,United States,2021,1,,
AE,Adams Resources & Energy Inc. Common Stock,$26.78,-0.02,-0.075%,113842182.00,United States,,2365,Energy,Oilfield Services/Equipment
AEF,Aberdeen Emerging Markets Equity Income Fund Inc. Common Stock,$8.5838,0.0438,0.513%,435643112.00,United States,,6696,,
AGE,AgeX Therapeutics Inc. Common Stock,$1.3243,-0.0057,-0.429%,50237437.00,,2018,93044,Health Care,Major Pharmaceuticals
AIM,AIM ImmunoTech Inc. Common Stock,$2.1201,0.0001,0.005%,84146794.00,United States,,143171,Health Care,Biotechnology: Biological Products (No Diagnostic Substances)
AINC,Ashford Inc. (Holding Company) Common Stock,$9.8562,0.8062,8.908%,29663358.00,United States,2014,9794,Finance,Investment Managers
AIRI,Air Industries Group Common Stock,$1.32,0.01,0.763%,42240205.00,United States,,23759,Capital Goods,Military/Government/Technical
AMBO,Ambow Education Holding Ltd. American Depository Shares each representing two Class A ordinary shares,$2.70,0.30,12.50%,62703909.00,China,,645598,Miscellaneous,Service to the Health Industry
AMPE,Ampio Pharmaceuticals Inc.,$1.90,-0.03,-1.554%,371695343.00,United States,,266060,Health Care,Major Pharmaceuticals
AMS,American Shared Hospital Services Common Stock,$3.23,0.51,18.75%,18737230.00,United States,,3757981,Health Care,Medical Specialities
ANVS,Annovis Bio Inc. Common Stock,$22.30,0.75,3.48%,154924099.00,United States,2020,13124,Consumer Durables,Specialty Chemicals
APT,Alpha Pro Tech Ltd. Common Stock,$8.70,0.02,0.23%,118291786.00,Canada,,45909,,
ARMP,Armata Pharmaceuticals Inc. Common Stock,$4.10,-0.03,-0.726%,102255812.00,United States,,1911,Health Care,Biotechnology: Biological Products (No Diagnostic Substances)
ASM,Avino Silver & Gold Mines Ltd. Common Shares (Canada),$1.265,-0.005,-0.394%,126240984.00,Canada,,139863,,
ASXC,Asensus Surgical Inc. Common Stock,$1.91,0.06,3.243%,444695427.00,United States,,1846978,Health Care,Medical/Dental Instruments
ATNM,Actinium Pharmaceuticals Inc. (Delaware) Common Stock,$7.4406,0.1606,2.206%,143199094.00,United States,,28656,Health Care,Major Pharmaceuticals
AUMN,Golden Minerals Company Common Stock,$0.7775,-0.0025,-0.321%,126320123.00,United States,,210443,,
AWX,Avalon Holdings Corporation Common Stock,$3.4566,0.0166,0.483%,13478773.00,United States,,3422,Public Utilities,Environmental Services
AXU,Alexco Resource Corp Common Shares (Canada),$2.83,-0.03,-1.049%,401665222.00,Canada,,139690,,
BATL,Battalion Oil Corporation Common Stock,$13.10,0.10,0.769%,213099757.00,,,2449,Energy,Oil & Gas Production
BCV,Bancroft Fund Ltd.,$31.47,0.58,1.878%,173644725.00,United States,,1188,,
BCV^A,Bancroft Fund Limited 5.375% Series A Cumulative Preferred Shares,$25.68,0.0699,0.273%,,United States,,805,,
BDL,Flanigan's Enterprises Inc. Common Stock,$24.53,0.00,0.00%,45592611.00,United States,,15,Consumer Services,Restaurants
BDR,Blonder Tongue Laboratories Inc. Common Stock,$1.11,0.0109,0.992%,13276161.00,United States,,110525,Capital Goods,Industrial Machinery/Components
BGI,Birks Group Inc. Common Stock,$1.91,0.05,2.688%,34324383.00,Canada,,143461,,
BHB,Bar Harbor Bankshares Inc. Common Stock,$28.97,-0.08,-0.275%,432959460.00,United States,,1276,Finance,Major Banks
BKTI,BK Technologies Corporation Common Stock,$4.69,-0.09,-1.883%,58796049.00,United States,,1279,Technology,Radio And Television Broadcasting And Communications Equipment
BMTX,BM Technologies Inc. Common Stock,$9.78,-0.02,-0.204%,119318954.00,,2018,1995,Technology,EDP Services
BRBS,Blue Ridge Bankshares Inc. Common Stock,$15.935,-0.065,-0.406%,296674595.00,,,13913,Finance,Commercial Banks
BRG,Bluerock Residential Growth REIT Inc. Class A Common Stock,$9.07,-0.10,-1.091%,208406197.00,,2014,107156,Consumer Services,Real Estate Investment Trusts
BRG^C,Bluerock Residential Growth REIT Inc. 7.625% Series C Cumulative Redeemable Preferred Stock,$25.38,-0.14,-0.549%,,,,200,,
BRG^D,Bluerock Residential Growth REIT Inc. 7.125% Series D Cumulative Preferred Stock ($0.01 par value per share),$25.34,0.01,0.039%,,,,197,,
BRN,Barnwell Industries Inc. Common Stock,$2.76,0.08,2.985%,22844962.00,United States,,335514,Energy,Oil & Gas Production
BTG,B2Gold Corp Common shares (Canada),$4.8899,-0.0601,-1.214%,5143205749.00,Canada,,3490707,,
BTN,Ballantyne Strong Inc. Common Stock,$5.12,-0.18,-3.396%,93703905.00,United States,,114838,Miscellaneous,Industrial Machinery/Components
BTX,Brooklyn ImmunoTherapeutics Inc. Common Stock,$51.3399,-3.8501,-6.976%,2131333131.00,United States,,3321235,,
BWL/A,Bowl America Inc.,$10.71,0.30,2.882%,,United States,,1199,,
CANF,Can-Fite Biopharma Ltd Sponsored ADR (Israel),$2.10,-0.05,-2.326%,36102240.00,Israel,,52449,,
CCF,Chase Corporation Common Stock,$118.64,-0.12,-0.101%,1120954735.00,United States,,8076,,
CDOR,Condor Hospitality Trust Inc. Common Stock,$3.97,0.03,0.761%,47719960.00,United States,,2477,,
CEI,Camber Energy Inc. Common Stock,$0.6994,0.0105,1.524%,24755360.00,United States,,946648,,
CET,Central Securities Corporation Common Stock,$38.90,0.00,0.00%,1020751677.00,United States,,72,,
CEV,Eaton Vance California Municipal Income Trust Shares of Beneficial Interest,$13.60,0.02,0.147%,97016620.00,United States,1999,4786,,
CHAQ,Chardan Healthcare Acquisition 2 Corp. Common Stock,$10.10,0.00,0.00%,108860881.00,,2020,10012,,
CHFW,Consonance-HFW Acquisition Corp. Class A Ordinary Shares,$9.89,0.01,0.101%,119016260.00,,2021,1689,,
CIK,Credit Suisse Asset Management Income Fund Inc. Common Stock,$3.505,0.005,0.143%,183328776.00,United States,,327510,,
CIX,CompX International Inc. Common Stock,$22.82,1.72,8.152%,282994403.00,United States,1998,11357,,
CKX,CKX Lands Inc. Common Stock,$11.8504,0.00,0.00%,23019343.00,United States,,58,,
CLM,Cornerstone Strategic Value Fund Inc. New Common Stock,$11.85,0.07,0.594%,920418355.00,United States,1987,381649,,
CMCL,Caledonia Mining Corporation Plc Common Shares,$14.23,0.02,0.141%,172450851.00,Canada,,11459,,
CMT,Core Molding Technologies Inc Common Stock,$11.60,-0.12,-1.024%,98322145.00,United States,,3051,,
COHN,Cohen & Company Inc.,$34.40,1.24,3.739%,45650073.00,United States,,3999,,
CPHI,China Pharma Holdings Inc. Common Stock,$0.6598,-0.0096,-1.434%,30073392.00,China,,275437,,
CQP,Cheniere Energy Partners LP Cheniere Energy Partners LP Common Units,$42.48,-0.13,-0.305%,20561217305.00,United States,2007,56289,,
CRF,Cornerstone Total Return Fund Inc. (The) Common Stock,$11.421,0.041,0.36%,468759047.00,United States,,247162,,
CTEK,CynergisTek Inc. Common Stock,$1.73,0.03,1.765%,20968808.00,United States,2017,8048,,
CVM,Cel-Sci Corporation Common Stock,$21.41,-1.09,-4.844%,867731842.00,United States,,203165,,
CVR,Chicago Rivet & Machine Co. Common Stock,$26.18,0.00,0.00%,25293336.00,United States,,15,,
CVU,CPI Aerostructures Inc. Common Stock,$4.3399,0.0299,0.694%,52654297.00,United States,,6155,,
DHY,Credit Suisse High Yield Bond Fund Common Stock,$2.47,0.0099,0.402%,255663283.00,United States,1998,453079,,
DIT,AMCON Distributing Company Common Stock,$141.41,0.205,0.145%,77969090.00,United States,,400,,
DLA,Delta Apparel Inc. Common Stock,$33.4998,-0.0302,-0.09%,233649715.00,United States,,3618,,
DMF,BNY Mellon Municipal Income Inc. Common Stock,$9.01,0.00,0.00%,186964690.00,United States,1988,5539,,
DNN,Denison Mines Corp Ordinary Shares (Canada),$1.2198,0.1398,12.944%,974042645.00,Canada,,19458819,,
DPW,Ault Global Holdings Inc. Common Stock,$3.175,0.525,19.811%,157158296.00,United States,,20961692,,
DSS,Document Security Systems Inc. Common Stock,$2.92,-0.01,-0.341%,80796765.00,United States,,161396,,
DXF,Dunxin Financial Holdings Limited American Depositary Shares,$1.9209,0.0909,4.967%,40098536.00,China,,117972,,
DXR,Daxor Corporation Common Stock,$9.44,-0.36,-3.673%,38079799.00,United States,,7409,,
EAD,Wells Fargo Income Opportunities Fund Common Shares,$8.675,-0.005,-0.058%,525585406.00,United States,2003,32058,,
ECF,Ellsworth Growth and Income Fund Ltd.,$14.245,0.065,0.458%,192299779.00,United States,1986,3400,,
ECF^A,Ellsworth Growth and Income Fund Ltd. 5.25% Series A Cumulative Preferred Shares (Liquidation Preference $25.00 per share),$25.95,0.035,0.135%,,United States,,617,,
EIM,Eaton Vance Municipal Bond Fund Common Shares of Beneficial Interest $.01 par value,$13.51,0.00,0.00%,972087516.00,United States,2002,35692,,
ELA,Envela Corporation Common Stock,$3.77,0.09,2.446%,101504916.00,United States,,11085,,
ELLO,Ellomay Capital Ltd Ordinary Shares (Israel),$30.52,0.32,1.06%,391859312.00,Israel,,890,,
ELMD,Electromed Inc. Common Stock,$9.91,0.00,0.00%,85573296.00,United States,2011,7041,,
EMAN,eMagin Corporation Common Stock,$2.54,-0.03,-1.167%,180642725.00,United States,,132480,,
EMX,EMX Royalty Corporation Common Shares (Canada),$3.43,-0.01,-0.291%,291532500.00,Canada,,75156,,
ENSV,Enservco Corporation Common Stock,$1.39,-0.01,-0.714%,15662445.00,United States,,145635,,
ENX,Eaton Vance New York Municipal Bond Fund Common Shares of Beneficial Interest $.01 par value,$12.54,0.09,0.723%,227203407.00,United States,2002,3500,,
EPM,Evolution Petroleum Corporation Inc. Common Stock,$3.615,0.065,1.831%,121068338.00,United States,,51378,,
EQX,Equinox Gold Corp. Common Shares,$8.12,0.07,0.87%,2417450599.00,Canada,,378292,,
ERC,Wells Fargo Multi-Sector Income Fund Common Stock no par value,$12.8322,0.0022,0.017%,360996580.00,United States,2003,17287,,
ERH,Wells Fargo Utilities and High Income Fund,$13.90,0.05,0.361%,128923404.00,,2004,4869,,
ESP,Espey Mfg. & Electronics Corp. Common Stock,$15.231,0.00,0.00%,41163803.00,United States,,5,,
EVBN,Evans Bancorp Inc. Common Stock,$35.26,-0.49,-1.371%,191426293.00,United States,,3714,,
EVI,EVI Industries Inc.  Common Stock,$26.985,0.655,2.488%,330603732.00,United States,,872,,
EVM,Eaton Vance California Municipal Bond Fund Common Shares of Beneficial Interest $.01 par value,$11.88,0.03,0.253%,296932747.00,United States,2002,2451,,
EVV,Eaton Vance Limited Duration Income Fund Common Shares of Beneficial Interest,$12.90,0.01,0.078%,1498296532.00,United States,2003,86917,,
EVY,Eaton Vance New York Municipal Income Trust Shares of Beneficial Interest,$14.95,0.09,0.606%,80757329.00,United States,1999,544,,
EXN,Excellon Resources Inc. Common Shares,$2.62,0.09,3.557%,84814939.00,,2020,2077,,
FAX,Aberdeen Asia-Pacific Income Fund Inc Common Stock,$4.28,0.00,0.00%,1060137887.00,United States,1986,134099,,
FCO,Aberdeen Global Income Fund Inc. Common Stock,$8.50,0.00,0.00%,74258652.00,United States,1992,13927,,
FEN,First Trust Energy Income and Growth Fund,$14.06,0.00,0.00%,273404714.00,United States,2004,15085,,
FRD,Friedman Industries Inc. Common Stock,$10.0488,-0.3712,-3.562%,69395495.00,United States,,19295,,
FSI,Flexible Solutions International Inc. Common Stock (CDA),$3.315,-0.055,-1.632%,40816087.00,Canada,,7546,,
FSP,Franklin Street Properties Corp. Common Stock,$5.02,-0.23,-4.381%,538787559.00,United States,,73534,,
FTF,Franklin Limited Duration Income Trust Common Shares of Beneficial Interest,$9.27,0.00,0.00%,279387000.00,United States,2003,17968,,
FTSI,FTS International Inc. Class A Common Stock,$29.90,2.88,10.659%,418300103.00,United States,2020,27415,,
FURY,Fury Gold Mines Limited Common Shares,$1.24,0.02,1.639%,146114966.00,,2020,30827,,
GAU,Galiano Gold Inc.,$1.27,-0.02,-1.55%,285195292.00,Canada,,326731,,
GBR,New Concept Energy Inc Common Stock,$4.3347,0.0347,0.807%,22245394.00,United States,,330691,,
GDP,Goodrich Petroleum Corporation Common Stock,$10.83,0.17,1.595%,145146812.00,United States,2017,14432,,
GGN,GAMCO Global Gold Natural Resources & Income Trust,$3.76,0.01,0.267%,578965308.00,United States,2005,155434,,
GGN^B,GAMCO Global Gold Natural Reources & Income Trust 5.00% Series B Cumulative 25.00 Liquidation Preference,$25.40,0.048,0.189%,,United States,,3418,,
GGO,The Gabelli Go Anywhere Trust Common Shares of Beneficial Interest,$15.74,0.00,0.00%,24349024.00,,2016,2,,
GLDG,GoldMining Inc. Common Shares,$1.555,-0.025,-1.582%,232490196.00,,,107379,,
GLO,Clough Global Opportunities Fund Common Stock,$13.00,0.03,0.231%,418917356.00,United States,2006,30264,,
GLQ,Clough Global Equity Fund Clough Global Equity Fund Common Shares of Beneficial Interest,$15.87,0.01,0.063%,209973256.00,United States,2005,53616,,
GLU,Gabelli Global Utility Common Shares of Beneficial Ownership,$20.84,0.11,0.531%,111985366.00,United States,2004,13794,,
GLU^A,The Gabelli Global Utility and Income Trust Series A Cumulative Puttable and Callable Preferred Shares,$45.40,-0.0261,-0.057%,,United States,,141,,
GLU^B,The Gabelli Global Utility and Income Trust Series B Cumulative Puttable and Callable Preferred Shares,$52.00,-0.11,-0.211%,,United States,,2682,,
GLV,Clough Global Dividend and Income Fund Common Shares of beneficial interest,$11.9405,0.0675,0.569%,100392428.00,United States,2004,12646,,
GOED,1847 Goedeker Inc. Commom Stock,$5.605,0.055,0.991%,34253276.00,United States,2020,13579,,
GORO,Gold Resource Corporation Common Stock,$2.695,-0.025,-0.919%,200613657.00,United States,,195694,,
GPL,Great Panther Mining Limited Ordinary Shares (Canada),$0.789,-0.016,-1.988%,280150556.00,Canada,,587929,,
GRF,Eagle Capital Growth Fund Inc. Common Stock,$8.71,-0.0787,-0.895%,35487336.00,United States,,459,,
GROY,Gold Royalty Corp. Common Shares,$4.835,0.005,0.104%,197388875.00,,2021,65166,,
GSAT,Globalstar Inc. Common Stock,$1.2416,-0.0584,-4.492%,2222091520.00,United States,2006,2900201,,
GSS,Golden Star Resources Ltd Common Stock,$3.565,-0.015,-0.419%,396832966.00,United States,,56452,,
GSV,Gold Standard Ventures Corporation Common Stock (Canada),$0.5797,-0.0103,-1.746%,207228956.00,Canada,,192263,,
GTE,Gran Tierra Energy Inc. Common Stock,$0.7911,0.1211,18.075%,290319109.00,Canada,,10179625,,
HLM^,Hillman Group Capital Trust Preferred Stock,$26.35,-0.03,-0.114%,,United States,,1011,,
HMG,HMG/Courtland Properties Inc. Common Stock,$12.205,0.00,0.00%,12293462.00,United States,,20,,
HNW,Pioneer Diversified High Income Fund Inc.,$15.06,0.02,0.133%,125491817.00,United States,2007,10701,,
HUSA,Houston American Energy Corporation Common Stock,$1.7499,0.0699,4.161%,17364849.00,United States,,151232,,
HWM^,Howmet Aerospace Inc. $3.75 Preferred Stock,$75.50,0.00,0.00%,,United States,,147,,
IAF,Aberdeen Australia Equity Fund Inc Common Stock,$6.40,0.04,0.629%,149146182.00,United States,,19632,,
IBIO,iBio Inc. Common Stock,$1.68,0.39,30.233%,362896684.00,United States,,112746209,,
ID,PARTS iD Inc. Class A Common Stock,$7.29,-0.20,-2.67%,239647502.00,United States,2017,8317,,
IGC,India Globalization Capital Inc. Common Stock,$1.495,-0.055,-3.548%,67822653.00,United States,,340943,,
IHT,InnSuites Hospitality Trust Shares of Beneficial Interest,$2.18,0.1199,5.82%,19758461.00,United States,,5122,,
IMH,Impac Mortgage Holdings Inc. Common Stock ,$1.9963,-0.0437,-2.142%,42576456.00,United States,1997,17478,,
IMO,Imperial Oil Limited Common Stock,$30.19,0.43,1.445%,22161777233.00,Canada,,318451,,
INDO,Indonesia Energy Corporation Limited Ordinary Shares,$5.43,0.00,0.00%,40225196.00,,2019,368,,
INFU,InfuSystems Holdings Inc. Common Stock,$21.94,0.10,0.458%,446651229.00,United States,,5883,,
INS,Intelligent Systems Corporation Common Stock,$37.00,-0.06,-0.162%,328646950.00,United States,1992,16567,,
INTT,inTest Corporation Common Stock,$12.57,0.38,3.117%,134537414.00,United States,1997,15896,,
INUV,Inuvo Inc.,$0.8064,-0.015,-1.826%,95571467.00,United States,,300774,,
IOR,Income Opportunity Realty Investors Inc. Common Stock,$12.33,0.00,0.00%,51396545.00,United States,,1,,
ISDR,Issuer Direct Corporation Common Stock,$29.00,0.34,1.186%,109359058.00,United States,,1983,,
ISR,IsoRay Inc. Common Stock (DE),$0.8738,0.0049,0.564%,123380432.00,United States,,204011,,
ITP,IT Tech Packaging Inc. Common Stock,$0.5106,-0.0103,-1.977%,50572837.00,China,,378558,,
ITRG,Integra Resources Corp. Common Shares,$3.00,0.03,1.01%,164390730.00,,,8603,,
JOB,GEE Group Inc. Common Stock,$0.5958,-0.0092,-1.521%,60176072.00,United States,,2456481,,
KIQ,Kelso Technologies Inc Ordinary Shares,$0.7287,-0.0066,-0.898%,39473742.00,Canada,,236695,,
KLR,Kaleyra Inc. Common Stock,$13.20,0.27,2.088%,399810668.00,United States,2018,28833,,
LCTX,Lineage Cell Therapeutics Inc. Common Stock,$2.7499,0.1699,6.585%,412433706.00,United States,,260588,,
LEU,Centrus Energy Corp. Class A Common Stock,$25.44,0.91,3.71%,340384045.00,United States,2014,23876,,
LGL,LGL Group Inc. (The) Common Stock,$10.76,0.01,0.093%,57328914.00,United States,,202,,
LNG,Cheniere Energy Inc. Common Stock,$80.85,1.30,1.634%,20496040788.00,United States,,359405,,
LODE,Comstock Mining Inc. Common Stock,$3.626,-0.154,-4.074%,153943697.00,United States,,175831,,
LOV,Spark Networks Inc. American Depositary Shares (each representing one-tenth of an Ordinary Share),$7.20,0.03,0.418%,187609608.00,United States,2017,24047,,
LSF,Laird Superfood Inc. Common Stock,$37.19,-0.31,-0.827%,330818141.00,,2020,7828,,
LXFR,Luxfer Holdings PLC Ordinary Shares,$22.26,-0.18,-0.802%,637741543.00,United Kingdom,2012,5736,,
MAG,MAG Silver Corporation Ordinary Shares,$18.35,-0.30,-1.609%,1738539225.00,Canada,,146463,,
MCF,Contango Oil & Gas Company Common Stock (TX),$4.14,0.14,3.50%,824468497.00,United States,,225358,,
MHH,Mastech Digital Inc Common Stock,$15.58,-0.42,-2.625%,177973643.00,United States,,3228,,
MLSS,Milestone Scientific Inc. Common Stock,$2.67,-0.10,-3.61%,177711329.00,United States,2015,208428,,
MMX,Maverix Metals Inc. Common Shares,$5.68,0.00,0.00%,800924372.00,,,35333,,
MSN,Emerson Radio Corporation Common Stock,$1.12,0.00,0.00%,23567770.00,United States,,30038,,
MTA,Metalla Royalty & Streaming Ltd. Common Shares,$8.97,-0.13,-1.429%,374343943.00,,,123574,,
MTNB,Matinas Biopharma Holdings Inc. Common Stock,$0.871,0.0081,0.939%,177924755.00,United States,2017,290204,,
MXC,Mexco Energy Corporation Common Stock,$7.70,0.12,1.583%,15951828.00,United States,,7886,,
MYO,Myomo Inc. Common Stock,$10.33,0.12,1.175%,57671047.00,United States,2017,41763,,
NAK,Northern Dynasty Minerals Ltd. Common Stock,$0.5581,-0.0094,-1.656%,286188210.00,Canada,,1665917,,
NAVB,Navidea Biopharmaceuticals Inc. Common Stock,$1.71,0.07,4.268%,48850080.00,United States,,97287,,
NBA,New Beginnings Acquisition Corp. Common Stock,$10.00,0.00,0.00%,149200000.00,,2020,148,,
NBH,Neuberger Berman Municipal Fund Inc. Common Stock,$16.64,-0.24,-1.422%,313133117.00,United States,2002,6021,,
NBO,Neuberger Berman New York Municipal Fund Inc. Common Stock,$12.72,0.11,0.872%,64584744.00,United States,2002,7590,,
NBW,Neuberger Berman California Municipal Fund Inc Common Stock,$14.005,-0.035,-0.249%,77742371.00,United States,2002,4116,,
NBY,NovaBay Pharmaceuticals Inc. Common Stock,$0.7879,-0.0049,-0.618%,32920498.00,United States,2007,78779,,
NEN,New England Realty Associates Limited Partnership Class A Depositary Receipts Evidencing Units of Limited Partnership,$57.50,0.00,0.00%,210030020.00,United States,,100,,
NES,Nuverra Environmental Solutions Inc. Common Stock,$2.04,0.0027,0.133%,32625897.00,United States,2017,1793,,
NG,Novagold Resources Inc.,$9.08,-0.05,-0.548%,3008487151.00,Canada,,88035,,
NGD,New Gold Inc.,$1.695,-0.005,-0.294%,1147309561.00,Canada,,1773776,,
NHC,National HealthCare Corporation Common Stock,$71.9193,0.3493,0.488%,1106067412.00,United States,,3790,,
NHS,Neuberger Berman High Yield Strategies Fund,$12.985,0.065,0.503%,253734496.00,United States,,25039,,
NML,Neuberger Berman MLP and Energy Income Fund Inc. Common Stock,$4.62,0.11,2.439%,261764247.00,,2013,39138,,
NNVC,NanoViricides Inc. Common Stock,$3.9352,-0.0148,-0.375%,42016130.00,United States,,9536,,
NOG,Northern Oil and Gas Inc. Common Stock,$15.8199,1.0899,7.399%,954913637.00,United States,,541923,,
NRO,Neuberger Berman Real Estate Securities Income Fund Inc. Neuberger Berman Real Estate Securities Income Fund Inc.,$4.705,-0.04,-0.843%,223112987.00,United States,2003,69544,,
NSPR,InspireMD Inc. Common Stock,$5.2731,0.0931,1.797%,41408758.00,Israel,,81715,,
NTIP,Network-1 Technologies Inc. Common Stock,$3.28,0.03,0.923%,79104183.00,United States,,970,,
NXE,Nexgen Energy Ltd. Common Shares,$4.56,0.49,12.039%,2140162671.00,,,1726760,,
OGEN,Oragenics Inc. Common Stock,$0.7212,-0.0217,-2.921%,79076781.00,United States,,747259,,
ORLA,Orla Mining Ltd. Common Shares,$3.55,0.005,0.141%,843788939.00,,2020,82481,,
PCG^A,Pacific Gas & Electric Co. 6% Preferred Stock,$29.67,0.9143,3.18%,,United States,,3309,,
PCG^B,Pacific Gas & Electric Co. 5 1/2% Preferred Stock,$26.3614,-0.2586,-0.971%,,United States,,562,,
PCG^C,Pacific Gas & Electric Co. 5% 1st Preferred Stock,$24.60,0.00,0.00%,,United States,,7,,
PCG^D,Pacific Gas & Electric Co. 5% 1st  Red. Preferred Stock,$24.62,0.0173,0.07%,,United States,,229,,
PCG^E,Pacific Gas & Electric Co. 5% 1st A Preferred Stock,$24.60,-0.16,-0.646%,,United States,,125,,
PCG^G,Pacific Gas & Electric Co. 4.80% 1st Preferred Stock,$23.99,0.42,1.782%,,United States,,1474,,
PCG^H,Pacific Gas & Electric Co. 4.50% 1st Preferred Stock,$22.08,0.51,2.364%,,United States,,6857,,
PCG^I,Pacific Gas & Electric Co. 4.36% 1st Preferred Stock,$22.43,0.00,0.00%,,United States,,21,,
PED,Pedevco Corp. Common Stock,$1.43,0.01,0.704%,113601492.00,United States,,88579,,
PHGE,BiomX Inc. COmmon Stock,$6.67,0.11,1.677%,161720887.00,,2019,9044,,
PLAG,Planet Green Holdings Corp. Common Stock,$1.885,-0.045,-2.332%,37718718.00,China,,33313,,
PLG,Platinum Group Metals Ltd. Ordinary Shares (Canada),$4.90,0.01,0.204%,362393779.00,Canada,,162464,,
PLM,Polymet Mining Corporation Ordinary Shares (Canada),$2.9001,-0.0199,-0.682%,292138030.00,Canada,,19938,,
PLX,Protalix BioTherapeutics Inc. (DE) Common Stock,$2.99,0.04,1.356%,135694665.00,Israel,,477812,,
PLYM^A,Plymouth Industrial REIT Inc. 7.50% Series A Cumulative Redeemable Preferred Stock,$26.605,0.00,0.00%,,United States,,1,,
PRK,Park National Corporation Common Stock,$126.79,-1.06,-0.829%,2071235227.00,United States,,1919,,
PTK,PTK Acquisition Corp. Common Stock,$9.95,0.01,0.101%,143031250.00,United States,2020,150,,
PTN,Palatin Technologies Inc. Common Stock,$0.5895,0.0121,2.096%,135614293.00,United States,,327627,,
PW,Power REIT (MD) Common Stock,$44.50,0.22,0.497%,146815869.00,United States,,17284,,
PW^A,Power REIT 7.75% Series A Cumulative Perpetual Preferred Stock,$26.50,0.00,0.00%,,United States,,47,,
PZG,Paramount Gold Nevada Corp. Common Stock,$1.0434,0.0033,0.317%,37798778.00,United States,2015,22557,,
RCG,RENN Fund Inc Common Stock,$2.66,0.00,0.00%,15832203.00,United States,,61,,
REI,Ring Energy Inc. Common Stock,$2.37,0.14,6.278%,235060361.00,United States,,1014748,,
REPX,Riley Exploration Permian Inc. Common Stock,$35.6502,1.2902,3.755%,642470864.00,United States,,2237,,
RHE,Regional Health Properties Inc. Common Stock,$15.9601,6.0301,60.726%,26944144.00,,2017,22070998,,
RHE^A,Regional Health Properties Inc. 10.875% Series A Cumulative Redeemable Preferred Stock,$4.20,0.51,13.821%,,,,24767,,
RLGT,Radiant Logistics Inc. Common Stock,$6.979,0.059,0.853%,348723455.00,United States,,13749,,
RMED,Ra Medical Systems Inc. Common Stock,$3.6715,-0.0485,-1.304%,11954331.00,,2018,311091,,
RVP,Retractable Technologies Inc. Common Stock,$9.73,0.50,5.417%,330650737.00,United States,,141266,,
SACC,Sachem Capital Corp. 6.875% Notes due 2024,$25.40,0.05,0.197%,0.00,United States,2019,2152,,
SACH,Sachem Capital Corp. Common Shares,$5.10,0.00,0.00%,113772172.00,United States,2017,60683,,
SCCB,Sachem Capital Corp. 7.125% Notes due 2024,$25.60,0.00,0.00%,0.00,United States,2019,49,,
SCCC,Sachem Capital Corp. 7.75% Notes due 2025,$25.995,-0.255,-0.971%,0.00,United States,2020,14578,,
SDPI,Superior Drilling Products Inc. Common Stock,$0.86,-0.0135,-1.546%,22155614.00,,2014,35153,,
SEB,Seaboard Corporation Common Stock,$3711.9999,-10.8101,-0.29%,4308811532.00,United States,1996,221,,
SENS,Senseonics Holdings Inc. Common Stock,$1.9922,0.0422,2.164%,852492231.00,United States,,2240337,,
SIF,SIFCO Industries Inc. Common Stock,$12.9765,0.0465,0.36%,77329935.00,United States,,774,,
SILV,SilverCrest Metals Inc. Common Shares,$8.775,-0.135,-1.515%,1267618634.00,,2018,160537,,
SIM,Grupo Simec S.A.B. de C.V. American Depositary Shares,$14.75,-0.40,-2.64%,2447070297.00,Mexico,1993,1268,,
SMTS,Sierra Metals Inc. Common Stock,$3.54,0.07,2.017%,576349358.00,,,110614,,
SNMP,Evolve Transition Infrastructure LP Common Stock,$0.7708,-0.0192,-2.43%,43307689.00,United States,,196960,,
SSY,SunLink Health Systems Inc. Common Stock,$3.3213,0.4713,16.537%,22914715.00,United States,,2384069,,
STXS,Stereotaxis Inc. Common Stock,$6.8025,0.0025,0.037%,503932458.00,United States,,57117,,
SVM,Silvercorp Metals Inc. Common Shares,$5.6399,-0.0301,-0.531%,989002780.00,,,325810,,
SVT,Servotronics Inc. Common Stock,$7.85,0.00,0.00%,19456280.00,United States,,62,,
SYN,Synthetic Biologics Inc. Common Stock,$0.5103,-0.0063,-1.22%,66162730.00,United States,,854962,,
TGB,Taseko Mines Ltd. Common Stock,$2.18,0.11,5.314%,617195112.00,Canada,,1918254,,
THM,International Tower Hill Mines Ltd. Ordinary Shares (Canada),$1.02,0.02,2.00%,198806348.00,Canada,,16974,,
TKAT,Takung Art Co. Ltd. Common Stock,$29.43,-1.17,-3.824%,331716684.00,,,328202,,
