Symbol,Name,Last Sale,Net Change,% Change,Market Cap,Country,IPO Year,Volume,Sector,Industry
IMCR,Immunocore Holdings plc American Depositary Shares,$49.22,1.22,2.542%,2081794551.00,United Kingdom,2021,149019,Health Care,Biotechnology: Biological Products (No Diagnostic Substances)
INCY,Incyte Corp. Common Stock,$80.54,-1.01,-1.239%,17706195248.00,United States,,1551993,Health Care,Biotechnology: Commercial Physical & Biological Resarch
INDB,Independent Bank Corp. Common Stock,$83.44,0.92,1.115%,2750657340.00,United States,,325786,Finance,Major Banks
INFN,Infinera Corporation Common Stock,$10.65,0.26,2.502%,2056193753.00,United States,2007,4079089,Public Utilities,Telecommunications Equipment
INMD,InMode Ltd. Ordinary Shares,$69.10,0.80,1.171%,2638987804.00,Israel,2019,1273619,Health Care,Biotechnology: Electromedical & Electrotherapeutic Apparatus
INO,Inovio Pharmaceuticals Inc. Common Stock,$13.84,-0.13,-0.931%,2830992663.00,United States,,8944055,Health Care,Medical/Dental Instruments
INOV,Inovalon Holdings Inc. Class A Common Stock,$25.25,0.21,0.839%,3923843789.00,United States,2015,321741,Technology,EDP Services
INSM,Insmed Inc. Common Stock,$40.90,0.50,1.238%,4166389216.00,United States,,616022,Health Care,Major Pharmaceuticals
INTC,Intel Corporation Common Stock,$63.01,1.40,2.272%,256009630000.00,United States,,28265037,Technology,Semiconductors
INTU,Intuit Inc. Common Stock,$411.35,-4.04,-0.973%,112728749291.00,United States,1993,1287308,Technology,Computer Software: Prepackaged Software
IONS,Ionis Pharmaceuticals Inc. Common Stock,$57.69,0.16,0.278%,8066396658.00,United States,,519255,Health Care,Major Pharmaceuticals
IOSP,Innospec Inc. Common Stock,$99.85,2.85,2.938%,2454306410.00,United States,,77425,Basic Industries,Major Chemicals
IOVA,Iovance Biotherapeutics Inc. Common Stock,$47.19,0.79,1.703%,6922175291.00,United States,,758622,Health Care,Biotechnology: Biological Products (No Diagnostic Substances)
IPAR,Inter Parfums Inc. Common Stock,$68.82,1.10,1.624%,2170414742.00,United States,,89678,Consumer Non-Durables,Package Goods/Cosmetics
IPGP,IPG Photonics Corporation Common Stock,$234.56,2.44,1.051%,12531892007.00,United States,2006,279185,Technology,Semiconductors
IPHI,Inphi Corporation Common Stock,$170.55,2.43,1.445%,8887766068.00,United States,2010,1035611,Technology,Semiconductors
IQ,iQIYI Inc. American Depositary Shares,$24.72,-0.89,-3.475%,19367136935.00,China,2018,8829352,Consumer Services,Consumer Electronics/Video Chains
IRBT,iRobot Corporation Common Stock,$125.70,2.93,2.387%,3535606387.00,United States,2005,516732,Consumer Durables,Consumer Electronics/Appliances
IRDM,Iridium Communications Inc Common Stock,$47.37,0.02,0.042%,6360826215.00,United States,,1202655,Capital Goods,Telecommunications Equipment
IRTC,iRhythm Technologies Inc. Common Stock,$168.03,-2.27,-1.333%,4851264030.00,United States,2016,459856,Health Care,Medical/Dental Instruments
ISBC,Investors Bancorp Inc. Common Stock,$12.71,0.20,1.599%,3176459852.00,United States,,2681260,Finance,Major Banks
ISRG,Intuitive Surgical Inc. Common Stock,$750.15,-17.38,-2.264%,88306381245.00,United States,2000,746265,Health Care,Industrial Specialties
ITCI,Intra-Cellular Therapies Inc. Common Stock,$39.51,0.49,1.256%,3167024959.00,United States,,1039343,Health Care,Major Pharmaceuticals
ITRI,Itron Inc. Common Stock,$101.86,1.58,1.576%,4114829151.00,United States,1993,373624,Capital Goods,Electrical Products
JACK,Jack In The Box Inc. Common Stock,$99.18,-0.68,-0.681%,2274110717.00,United States,,539436,Consumer Services,Restaurants
JAMF,Jamf Holding Corp. Common Stock,$40.51,1.77,4.569%,4723319556.00,United States,2020,673995,Technology,Computer Software: Prepackaged Software
JAZZ,Jazz Pharmaceuticals plc Common Stock (Ireland),$160.60,1.59,1.00%,8947669364.00,Ireland,2007,543179,Health Care,Major Pharmaceuticals
JBHT,J.B. Hunt Transport Services Inc. Common Stock,$146.56,-0.34,-0.231%,15484650240.00,United States,,1083948,Transportation,Trucking Freight/Courier Services
JBLU,JetBlue Airways Corporation Common Stock,$17.39,0.58,3.45%,5468435906.00,United States,2002,6990680,Transportation,Air Freight/Delivery Services
JCOM,j2 Global Inc. Common Stock,$109.59,0.40,0.366%,4905093111.00,United States,1999,351091,Technology,Telecommunications Equipment
JD,JD.com Inc. American Depositary Shares,$106.09,0.66,0.626%,164426450930.00,China,2014,6446421,Consumer Services,Other Specialty Stores
JJSF,J & J Snack Foods Corp. Common Stock,$151.12,-1.23,-0.807%,2868202743.00,United States,1986,101060,Consumer Non-Durables,Specialty Foods
JKHY,Jack Henry & Associates Inc. Common Stock,$150.89,-1.82,-1.192%,11479299119.00,United States,1985,1057056,Technology,EDP Services
JOBS,51job Inc. American Depositary Shares,$69.70,1.69,2.485%,4697817429.00,China,2004,156345,Technology,Diversified Commercial Services
KC,Kingsoft Cloud Holdings Limited American Depositary Shares,$68.23,2.51,3.819%,14875352174.00,China,2020,1137011,Technology,Computer Software: Prepackaged Software
KDP,Keurig Dr Pepper Inc. Common Stock,$31.24,-0.50,-1.575%,43962592905.00,United States,,3174252,Consumer Non-Durables,Beverages (Production/Distribution)
KHC,The Kraft Heinz Company Common Stock,$37.48,-1.48,-3.799%,45844626998.00,United States,,14345362,Consumer Non-Durables,Packaged Foods
KLAC,KLA Corporation Common Stock,$330.67,5.51,1.695%,50947864846.00,United States,1980,1512397,Capital Goods,Electronic Components
KLIC,Kulicke and Soffa Industries Inc. Common Stock,$49.07,-0.61,-1.228%,3046117752.00,Singapore,,1326054,Technology,Semiconductors
KNSL,Kinsale Capital Group Inc. Common Stock,$179.82,-9.75,-5.143%,4077793065.00,United States,2016,463147,Finance,Property-Casualty Insurers
KOD,Kodiak Sciences Inc Common Stock,$131.44,-2.66,-1.984%,6673953933.00,United States,2018,361283,Health Care,Biotechnology: Biological Products (No Diagnostic Substances)
KRNT,Kornit Digital Ltd. Ordinary Shares,$119.41,0.43,0.361%,5406637382.00,Israel,2015,570144,Capital Goods,Industrial Machinery/Components
KRTX,Karuna Therapeutics Inc. Common Stock,$124.77,6.91,5.863%,3344655240.00,United States,2019,121169,Health Care,Major Pharmaceuticals
KTOS,Kratos Defense & Security Solutions Inc. Common Stock,$30.25,0.33,1.103%,3713372872.00,United States,,1279407,Capital Goods,Military/Government/Technical
KURA,Kura Oncology Inc. Common Stock,$33.81,1.39,4.287%,2232629454.00,United States,,532144,Health Care,Major Pharmaceuticals
KYMR,Kymera Therapeutics Inc. Common Stock,$54.68,-1.07,-1.919%,2431014894.00,United States,2020,314334,Health Care,Biotechnology: Biological Products (No Diagnostic Substances)
LAMR,Lamar Advertising Company Class A Common Stock,$85.33,1.01,1.198%,8605364277.00,United States,1996,337729,Consumer Services,Real Estate Investment Trusts
LANC,Lancaster Colony Corporation Common Stock,$178.47,-1.37,-0.762%,4916670030.00,United States,,113410,Consumer Non-Durables,Packaged Foods
LAUR,Laureate Education Inc. Class A Common Stock,$14.60,0.10,0.69%,3067058836.00,United States,2017,584709,Consumer Services,Other Consumer Services
LAZR,Luminar Technologies Inc.  Class A Common Stock,$33.69,0.85,2.588%,10913411926.00,United States,2019,8982033,Capital Goods,Auto Parts:O.E.M.
LBRDA,Liberty Broadband Corporation Class A Common Stock,$145.89,-1.23,-0.836%,34998022303.00,United States,,66132,Consumer Services,Television Services
LBRDK,Liberty Broadband Corporation Class C Common Stock,$148.99,-0.96,-0.64%,35741691295.00,United States,,1263996,Consumer Services,Television Services
LBTYA,Liberty Global plc Class A Ordinary Shares,$26.57,0.53,2.035%,15341850603.00,United Kingdom,,1880829,,
LBTYB,Liberty Global plc Class B Ordinary Shares,$27.50,0.00,0.00%,15878844245.00,United Kingdom,,269,Consumer Services,Television Services
LBTYK,Liberty Global plc Class C Ordinary Shares,$26.26,0.40,1.547%,15162852723.00,United Kingdom,,1503668,,
LECO,Lincoln Electric Holdings Inc. Common Shares,$115.41,2.20,1.943%,6863514872.00,United States,,200116,Technology,Industrial Machinery/Components
LEGN,Legend Biotech Corporation American Depositary Shares,$27.18,0.41,1.532%,3512812591.00,United States,2020,171484,Health Care,Major Pharmaceuticals
LESL,Leslie's Inc. Common Stock,$24.69,1.64,7.115%,4613902789.00,United States,2020,3455000,Consumer Services,Other Specialty Stores
LFUS,Littelfuse Inc. Common Stock,$278.56,11.40,4.267%,6789913649.00,United States,,72306,Consumer Durables,Electrical Products
LGIH,LGI Homes Inc. Common Stock,$119.00,2.93,2.524%,2986950694.00,United States,2013,287426,Capital Goods,Homebuilding
LGND,Ligand Pharmaceuticals Incorporated Common Stock,$142.87,-2.02,-1.394%,2297538046.00,United States,,313474,Health Care,Major Pharmaceuticals
LHCG,LHC Group Common Stock,$205.03,3.03,1.50%,6477360863.00,United States,2005,175446,Health Care,Medical/Nursing Services
LI,Li Auto Inc. American Depositary Shares,$29.84,0.40,1.359%,26784209585.00,China,2020,10238942,Capital Goods,Auto Manufacturing
LILA,Liberty Latin America Ltd. Class A Common Stock,$11.76,0.10,0.858%,2728395417.00,United States,,181853,Consumer Services,Television Services
LILAK,Liberty Latin America Ltd. Class C Common Stock,$11.48,-0.01,-0.087%,2663433621.00,United States,,566624,Consumer Services,Television Services
LITE,Lumentum Holdings Inc. Common Stock,$91.74,0.32,0.35%,6944718000.00,United States,,1537517,Capital Goods,Telecommunications Equipment
LIVN,LivaNova PLC Ordinary Shares,$70.19,-1.31,-1.832%,3410982509.00,United Kingdom,,454942,Health Care,Biotechnology: Electromedical & Electrotherapeutic Apparatus
LKQ,LKQ Corporation Common Stock,$38.79,0.18,0.466%,11805553411.00,United States,,2793534,Consumer Services,Motor Vehicles
LNT,Alliant Energy Corporation Common Stock,$47.63,-0.98,-2.016%,11896100379.00,United States,,1901149,Public Utilities,Power Generation
LOB,Live Oak Bancshares Inc. Common Stock,$48.77,1.89,4.032%,2070405791.00,United States,2015,236414,Finance,Major Banks
LOGI,Logitech International S.A. Ordinary Shares,$116.41,0.62,0.535%,19664131560.00,United States,1997,485712,Technology,Computer peripheral equipment
LOPE,Grand Canyon Education Inc. Common Stock,$110.42,3.13,2.917%,5173956344.00,United States,2008,629529,Consumer Services,Other Consumer Services
LPLA,LPL Financial Holdings Inc. Common Stock,$131.94,1.67,1.282%,10485367720.00,United States,2010,470288,Finance,Investment Bankers/Brokers/Service
LPRO,Open Lending Corporation Class A Common Stock,$38.74,0.74,1.947%,4480277475.00,United States,,804672,Finance,Finance: Consumer Services
LPSN,LivePerson Inc. Common Stock,$71.56,3.38,4.957%,4786303624.00,United States,2000,967109,Technology,Computer Software: Prepackaged Software
LRCX,Lam Research Corporation Common Stock,$598.41,20.64,3.572%,85517764779.00,United States,1984,1697789,Technology,Industrial Machinery/Components
LSCC,Lattice Semiconductor Corporation Common Stock,$48.25,1.81,3.898%,6569520728.00,United States,,1166914,Technology,Semiconductors
LSTR,Landstar System Inc. Common Stock,$160.12,3.10,1.974%,6146376408.00,United States,1993,319063,Transportation,Trucking Freight/Courier Services
LSXMA,Liberty Media Corporation Series A Liberty SiriusXM Common Stock,$43.98,0.90,2.089%,14969254547.00,United States,,775629,Consumer Services,Broadcasting
LSXMB,Liberty Media Corporation Series B Liberty SiriusXM Common Stock,$46.00,0.00,0.00%,15656791932.00,United States,,1,Consumer Services,Broadcasting
LSXMK,Liberty Media Corporation Series C Liberty SiriusXM Common Stock,$43.25,0.94,2.222%,14720788067.00,United States,,772880,Consumer Services,Broadcasting
LTRPB,Liberty TripAdvisor Holdings Inc. Series B Common Stock,$33.088,-0.122,-0.367%,2485582637.00,United States,,11440,Technology,EDP Services
LULU,lululemon athletica inc. Common Stock,$332.23,-4.60,-1.366%,43302208690.00,Canada,2007,1170988,Consumer Non-Durables,Apparel
LUNG,Pulmonx Corporation Common Stock,$57.62,1.49,2.655%,2055245072.00,United States,2020,97172,Health Care,Medical/Dental Instruments
LX,LexinFintech Holdings Ltd. American Depositary Shares,$15.27,1.58,11.541%,2761727985.00,China,2017,4243688,Finance,Finance: Consumer Services
LYFT,Lyft Inc. Class A Common Stock,$58.93,1.86,3.259%,19077828246.00,United States,2019,9236220,Miscellaneous,Business Services
MANH,Manhattan Associates Inc. Common Stock,$132.21,-1.21,-0.907%,8435278550.00,United States,1998,275682,Technology,Computer Software: Prepackaged Software
MANT,ManTech International Corporation Common Stock $0.01 Par Value,$82.46,-0.35,-0.423%,3327773242.00,United States,2002,215923,Consumer Services,Other Consumer Services
MAR,Marriott International Class A Common Stock,$136.28,4.30,3.258%,44199926256.00,United States,,2855746,Consumer Services,Hotels/Resorts
MARA,Marathon Patent Group Inc. Common Stock,$43.27,2.29,5.588%,4064987082.00,United States,,24080999,Technology,EDP Services
MASI,Masimo Corporation Common Stock,$259.35,-6.94,-2.606%,14278571048.00,United States,2007,242411,Health Care,Biotechnology: Electromedical & Electrotherapeutic Apparatus
MAT,Mattel Inc. Common Stock,$19.02,-0.04,-0.21%,6619726582.00,United States,,1629165,Consumer Non-Durables,Recreational Products/Toys
MCFE,McAfee Corp. Class A Common Stock,$19.47,-0.05,-0.256%,8262875578.00,United States,2020,398179,Technology,Computer Software: Prepackaged Software
MCHP,Microchip Technology Incorporated Common Stock,$162.35,6.20,3.971%,43714687811.00,United States,1993,1775807,Technology,Semiconductors
MCRB,Seres Therapeutics Inc. Common Stock,$24.45,0.97,4.131%,2231019419.00,United States,2015,664520,Health Care,Major Pharmaceuticals
MDB,MongoDB Inc. Class A Common Stock,$418.30,15.80,3.925%,25209400819.00,United States,2017,486654,Technology,Computer Software: Prepackaged Software
MDLZ,Mondelez International Inc. Class A Common Stock,$54.31,-1.82,-3.242%,76691941699.00,United States,,7071890,Consumer Non-Durables,Packaged Foods
MDRX,Allscripts Healthcare Solutions Inc. Common Stock,$16.56,-0.005,-0.03%,2616176637.00,United States,,4225651,Technology,EDP Services
MEDP,Medpace Holdings Inc. Common Stock,$159.40,-3.60,-2.209%,5702006270.00,United States,2016,298333,Health Care,Biotechnology: Commercial Physical & Biological Resarch
MELI,MercadoLibre Inc. Common Stock,$1910.39,19.30,1.021%,95270627764.00,Argentina,2007,475553,Miscellaneous,Business Services
MEOH,Methanex Corporation Common Stock,$37.24,0.64,1.749%,2837761735.00,Canada,,343731,Basic Industries,Major Chemicals
MGEE,MGE Energy Inc,$65.83,0.20,0.305%,2380634647.00,United States,,88827,Energy,Electric Utilities: Central
MGLN,Magellan Health Inc. Common Stock,$93.24,0.07,0.075%,2413745465.00,United States,,122632,Health Care,Hospital/Nursing Management
MGNI,Magnite Inc. Common Stock,$58.56,4.66,8.646%,6737807782.00,United States,,3148274,Technology,Computer Software: Programming Data Processing
MIDD,Middleby Corporation (The) Common Stock,$134.48,3.58,2.735%,7478736052.00,United States,,1208607,Technology,Industrial Machinery/Components
MIK,The Michaels Companies Inc. Common Stock,$15.05,0.14,0.939%,2222124975.00,United States,2014,2279094,Consumer Services,Recreational Products/Toys
MILE,Metromile Inc. Common Stock,$19.30,-0.23,-1.178%,2445840634.00,United States,2020,1444472,Finance,Property-Casualty Insurers
MIME,Mimecast Limited Ordinary Shares,$45.92,0.88,1.954%,2956454916.00,United Kingdom,2015,1415792,Technology,Computer Software: Prepackaged Software
MKSI,MKS Instruments Inc. Common Stock,$170.35,11.66,7.348%,9392602941.00,United States,1999,848652,Capital Goods,Industrial Machinery/Components
MKTX,MarketAxess Holdings Inc. Common Stock,$550.21,6.52,1.199%,20887887431.00,United States,2004,243746,Finance,Investment Bankers/Brokers/Service
MLCO,Melco Resorts & Entertainment Limited American Depositary Shares,$18.68,0.30,1.632%,8909472158.00,Hong Kong,,3266152,Consumer Services,Hotels/Resorts
MLHR,Herman Miller Inc. Common Stock,$37.28,-0.05,-0.134%,2198719971.00,United States,,304961,Consumer Durables,Office Equipment/Supplies/Services
MMSI,Merit Medical Systems Inc. Common Stock,$58.89,-0.25,-0.423%,3271190096.00,United States,,160632,Health Care,Medical/Dental Instruments
MMYT,MakeMyTrip Limited Ordinary Shares,$32.98,3.04,10.154%,3433156987.00,India,2010,854247,Consumer Services,Transportation Services
MNRO,Monro Inc. Common Stock,$63.59,-0.12,-0.188%,2125648748.00,United States,1991,192650,Consumer Services,Automotive Aftermarket
MNST,Monster Beverage Corporation,$89.65,-3.00,-3.238%,47327737265.00,United States,,2302721,Consumer Non-Durables,Beverages (Production/Distribution)
MODV,ModivCare Inc. Common Stock,$166.54,0.56,0.337%,2362142240.00,United States,,40644,Consumer Services,Transportation Services
MOMO,Momo Inc. American Depositary Shares,$18.24,-0.22,-1.192%,3792108823.00,China,2014,4026297,Technology,Computer Software: Prepackaged Software
MOR,MorphoSys AG American Depositary Shares,$26.60,-0.30,-1.115%,3483464393.00,Germany,2018,30020,Health Care,Major Pharmaceuticals
MORN,Morningstar Inc. Common Stock,$248.45,-0.76,-0.305%,10641844191.00,United States,2005,240052,Finance,Investment Managers
MPWR,Monolithic Power Systems Inc. Common Stock,$393.75,17.87,4.754%,17823881250.00,United States,2004,470634,Technology,Semiconductors
MRCY,Mercury Systems Inc Common Stock,$70.84,-0.52,-0.729%,3977101334.00,United States,1998,242927,Capital Goods,Electrical Products
MRNA,Moderna Inc. Common Stock,$174.74,5.17,3.049%,69146383748.00,United States,2018,6410762,Health Care,Biotechnology: Biological Products (No Diagnostic Substances)
MRTX,Mirati Therapeutics Inc. Common Stock,$204.71,4.57,2.283%,10293040092.00,United States,,225736,Health Care,Major Pharmaceuticals
MRVI,Maravai LifeSciences Holdings Inc. Class A Common Stock,$35.71,-0.28,-0.778%,9199633197.00,United States,2020,940864,Health Care,Major Pharmaceuticals
MRVL,Marvell Technology Group Ltd. Common Stock,$51.89,1.42,2.814%,34859702000.00,Bermuda,2000,9955586,Technology,Semiconductors
MSFT,Microsoft Corporation Common Stock,$240.97,-2.82,-1.157%,1817447733374.00,United States,1986,25216731,Technology,Computer Software: Prepackaged Software
MSTR,MicroStrategy Incorporated Common Stock Class A,$963.72,35.94,3.874%,9239204842.00,United States,1998,1151108,Technology,Computer Software: Prepackaged Software
MTCH,Match Group Inc. Common Stock,$160.95,-1.29,-0.795%,42810003122.00,United States,,2652251,Technology,Computer Software: Programming Data Processing
MTLS,Materialise NV American Depositary Shares,$66.32,1.84,2.854%,3592505124.00,Belgium,2014,454359,Technology,Computer Software: Prepackaged Software
MTSI,MACOM Technology Solutions Holdings Inc. Common Stock,$67.98,3.79,5.904%,4646058430.00,United States,2012,603731,Technology,Semiconductors
MU,Micron Technology Inc. Common Stock,$90.96,2.425,2.739%,101754358912.00,United States,,21874644,Technology,Semiconductors
MVIS,MicroVision Inc. Common Stock,$20.50,2.46,13.636%,3144821155.00,United States,1996,11958481,Capital Goods,Industrial Machinery/Components
MXIM,Maxim Integrated Products Inc. Common Stock,$98.15,3.57,3.775%,26308230726.00,United States,1988,2260235,Technology,Semiconductors
MYGN,Myriad Genetics Inc. Common Stock,$31.34,1.65,5.557%,2357096443.00,United States,1995,737114,Health Care,Biotechnology: In Vitro & In Vivo Diagnostic Substances
NARI,Inari Medical Inc. Common Stock,$118.69,3.61,3.137%,5781487344.00,United States,2020,267825,Health Care,Medical/Dental Instruments
NATI,National Instruments Corporation Common Stock,$46.33,0.62,1.356%,6080610501.00,United States,1995,440425,Technology,Computer Software: Prepackaged Software
NAVI,Navient Corporation Common Stock,$12.22,0.13,1.075%,2285140000.00,United States,,1250486,Finance,Investment Bankers/Brokers/Service
NBIX,Neurocrine Biosciences Inc. Common Stock,$113.24,-0.10,-0.088%,10638178360.00,United States,1996,491400,Health Care,Biotechnology: Biological Products (No Diagnostic Substances)
NCNO,nCino Inc. Common Stock,$81.36,2.54,3.223%,7509085646.00,United States,2020,1820339,Technology,Computer Software: Prepackaged Software
NDAQ,Nasdaq Inc. Common Stock,$144.43,-0.45,-0.311%,23691950135.00,United States,,669151,Finance,Investment Bankers/Brokers/Service
NDSN,Nordson Corporation Common Stock,$187.88,2.21,1.19%,10917588436.00,United States,,327105,Capital Goods,Industrial Machinery/Components
NEO,NeoGenomics Inc. Common Stock,$56.56,-0.23,-0.405%,6510693771.00,United States,,490581,Health Care,Precision Instruments
NEOG,Neogen Corporation Common Stock,$84.40,0.31,0.369%,4493798411.00,United States,1989,661609,Health Care,Biotechnology: In Vitro & In Vivo Diagnostic Substances
NFE,New Fortress Energy Inc. Class A Common Stock,$51.24,1.97,3.998%,8947675449.00,United States,2019,331141,Public Utilities,Oil/Gas Transmission
NFLX,Netflix Inc. Common Stock,$540.22,-8.00,-1.459%,239260877897.00,United States,2002,2838632,Consumer Services,Consumer Electronics/Video Chains
NGM,NGM Biopharmaceuticals Inc. Common Stock,$29.34,0.08,0.273%,2182136006.00,United States,2019,104813,Health Care,Major Pharmaceuticals
NICE,NICE Ltd American Depositary Shares,$248.52,-6.98,-2.732%,15590230699.00,Israel,,582743,Technology,Computer Software: Prepackaged Software
NIU,Niu Technologies American Depositary Shares,$44.19,0.51,1.168%,3303048896.00,China,2018,853482,Capital Goods,Auto Manufacturing
NK,NantKwest Inc. Common Stock,$39.12,2.17,5.873%,4259250675.00,United States,2015,1453150,Health Care,Biotechnology: Biological Products (No Diagnostic Substances)
NKLA,Nikola Corporation Common Stock,$21.36,1.00,4.912%,8204112717.00,United States,2018,6186666,Capital Goods,Auto Manufacturing
NKTR,Nektar Therapeutics  Common Stock,$24.92,-0.13,-0.519%,4470614757.00,United States,,1104258,Health Care,Major Pharmaceuticals
NLOK,NortonLifeLock Inc. Common Stock,$20.46,-0.255,-1.231%,11905687258.00,United States,,7060549,Technology,Computer Software: Prepackaged Software
NNDM,Nano Dimension Ltd. American Depositary Shares,$13.87,0.32,2.362%,2908399496.00,Israel,,23376318,Technology,Electrical Products
NNOX,NANO-X IMAGING LTD Ordinary Shares,$56.85,1.35,2.432%,2620794835.00,Israel,2020,2149253,Health Care,Medical Electronics
NOVT,Novanta Inc. Common Stock,$144.13,2.14,1.507%,5067699872.00,United States,,74703,Miscellaneous,Industrial Machinery/Components
NSIT,Insight Enterprises Inc. Common Stock,$83.57,0.91,1.101%,2933121892.00,United States,1995,239489,Consumer Services,Catalog/Specialty Distribution
NSTG,NanoString Technologies Inc. Common Stock,$82.42,6.71,8.863%,3631864334.00,United States,2013,611418,Health Care,Biotechnology: Biological Products (No Diagnostic Substances)
NTAP,NetApp Inc. Common Stock,$71.35,3.28,4.819%,15938508120.00,United States,1995,3231616,Technology,Electronic Components
NTCT,NetScout Systems Inc. Common Stock,$29.36,-0.29,-0.978%,2156162082.00,United States,1999,1606845,Technology,EDP Services
NTES,NetEase Inc. American Depositary Shares,$123.89,-0.43,-0.346%,84922641794.00,China,,1797028,Technology,Computer Software: Prepackaged Software
NTLA,Intellia Therapeutics Inc. Common Stock,$72.37,5.76,8.647%,4674702662.00,United States,2016,1246778,Health Care,Biotechnology: In Vitro & In Vivo Diagnostic Substances
NTNX,Nutanix Inc. Class A Common Stock,$33.69,0.36,1.08%,6790130659.00,United States,2016,2003388,Technology,Computer Software: Prepackaged Software
NTRA,Natera Inc. Common Stock,$119.61,5.56,4.875%,10211093380.00,United States,2015,646061,Health Care,Medical Specialities
NTRS,Northern Trust Corporation Common Stock,$96.31,0.30,0.312%,20060313590.00,United States,,1070804,Finance,Major Banks
NUAN,Nuance Communications Inc. Common Stock,$48.16,-0.21,-0.434%,13728491912.00,United States,,2781093,Technology,Computer Software: Prepackaged Software
NUVA,NuVasive Inc. Common Stock,$57.28,1.11,1.976%,2937525467.00,United States,2004,472809,Health Care,Medical/Dental Instruments
NVAX,Novavax Inc. Common Stock,$277.88,12.59,4.746%,18690195462.00,United States,,3448570,Health Care,Biotechnology: Biological Products (No Diagnostic Substances)
NVCR,NovoCure Limited Ordinary Shares,$190.17,14.45,8.223%,19358781321.00,Jersey,2015,698525,Health Care,Medical/Dental Instruments
NVDA,NVIDIA Corporation Common Stock,$597.06,3.90,0.657%,369580140000.00,United States,1999,6785435,Technology,Semiconductors
NVMI,Nova Measuring Instruments Ltd. Ordinary Shares,$84.65,1.10,1.317%,2377951401.00,Israel,2000,226225,Capital Goods,Electronic Components
NWE,NorthWestern Corporation Common Stock,$58.63,0.44,0.756%,2967628451.00,United States,,239041,Public Utilities,Power Generation
NWL,Newell Brands Inc. Common Stock,$24.32,0.68,2.876%,10318976000.00,United States,,3183446,Consumer Non-Durables,Plastic Products
NWS,News Corporation Class B Common Stock,$22.41,-0.18,-0.797%,13238105298.00,United States,,367707,Consumer Services,Newspapers/Magazines
NWSA,News Corporation Class A Common Stock,$22.50,-0.15,-0.662%,13291270380.00,United States,,5040500,Consumer Services,Newspapers/Magazines
NXPI,NXP Semiconductors N.V. Common Stock,$191.59,5.71,3.072%,53597224714.00,Netherlands,2010,2192738,Technology,Semiconductors
NXST,Nexstar Media Group Inc. Class A Common Stock,$124.62,0.03,0.024%,5488889769.00,United States,2003,451140,Consumer Services,Broadcasting
OCDX,Ortho Clinical Diagnostics plc Ordinary Shares,$16.79,-0.19,-1.119%,3928600863.00,United States,2021,807099,Health Care,Biotechnology: In Vitro & In Vivo Diagnostic Substances
ODFL,Old Dominion Freight Line Inc. Common Stock,$215.64,3.85,1.818%,25301353231.00,United States,1991,634915,Transportation,Trucking Freight/Courier Services
ODP,The ODP Corporation Common Stock,$45.00,0.82,1.856%,2407593915.00,United States,,268090,Consumer Services,Other Specialty Stores
