Symbol,Name,Last Sale,Net Change,% Change,Market Cap,Country,IPO Year,Volume,Sector,Industry
RAIL,FreightCar America Inc. Common Stock,$6.85,0.67,10.841%,106779663.00,United States,2005,765115,,
RAIN,Rain Therapeutics Inc. Common Stock,$16.99,0.03,0.177%,441216028.00,United States,2021,54757,,
RAND,Rand Capital Corporation Common Stock,$18.32,0.00,0.00%,47305336.00,United States,,12,,
RAPT,RAPT Therapeutics Inc. Common Stock,$21.97,0.06,0.274%,546346796.00,United States,2019,22710,,
RARE,Ultragenyx Pharmaceutical Inc. Common Stock,$108.61,6.76,6.637%,7328420976.00,United States,2014,69922,,
RAVE,Rave Restaurant Group Inc. Common Stock,$1.30,-0.03,-2.256%,23406375.00,United States,,86468,,
RAVN,Raven Industries Inc. Common Stock,$40.43,0.01,0.025%,1450203845.00,United States,,41071,,
RBB,RBB Bancorp Common Stock,$22.35,0.25,1.131%,436456343.00,United States,2017,8998,,
RBBN,Ribbon Communications Inc. Common Stock,$6.48,0.09,1.408%,954883663.00,United States,,93362,,
RBCAA,Republic Bancorp Inc. Class A Common Stock,$45.15,-0.01,-0.022%,940293900.00,United States,1998,2134,,
RBCN,Rubicon Technology Inc. Common Stock,$10.4001,-0.1673,-1.583%,25191694.00,United States,2007,608,,
RBKB,Rhinebeck Bancorp Inc. Common Stock,$10.43,-0.07,-0.667%,116120215.00,United States,2019,217,,
RBNC,Reliant Bancorp Inc. Common Stock,$28.72,-0.05,-0.174%,478314799.00,United States,,4420,,
RCAT,Red Cat Holdings Inc. Common Stock,$3.71,-0.13,-3.385%,101880035.00,United States,,153179,,
RCEL,Avita Therapeutics Inc. Common Stock,$20.32,0.29,1.448%,504807383.00,Australia,,10080,,
RCHG,Recharge Acquisition Corp. Class A Common Stock,$9.92,0.00,0.00%,248496000.00,United States,2020,1,,
RCHGU,Recharge Acquisition Corp. Unit,$10.20,0.025,0.246%,0.00,United States,2020,15823,,
RCHGW,Recharge Acquisition Corp. Warrant,$0.74,0.00,0.00%,0.00,United States,2020,22674,,
RCII,Rent-A-Center Inc. Common Stock,$60.59,0.37,0.614%,4017619109.00,United States,1995,116734,,
RCKT,Rocket Pharmaceuticals Inc. Common Stock,$44.29,1.90,4.482%,2736159977.00,United States,2015,24147,,
RCKY,Rocky Brands Inc. Common Stock,$62.36,8.55,15.889%,454025138.00,United States,1993,118519,,
RCLF,Rosecliff Acquisition Corp I Class A Common Stock,$9.791,-0.009,-0.092%,309640375.00,United States,2021,200,,
RCLFU,Rosecliff Acquisition Corp I Unit,$9.9901,-0.0099,-0.099%,0.00,United States,2021,4700,,
RCLFW,Rosecliff Acquisition Corp I Warrants,$0.56,-0.0041,-0.727%,0.00,United States,2021,234,,
RCM,R1 RCM Inc. Common Stock,$23.87,0.02,0.084%,6237057561.00,United States,,993638,,
RCMT,RCM Technologies Inc. Common Stock,$3.51,-0.05,-1.404%,40313438.00,United States,,36818,,
RCON,Recon Technology Ltd. Class A Ordinary Shares,$8.75,-0.51,-5.508%,63024780.00,China,2009,920684,,
RDCM,Radcom Ltd. Ordinary Shares,$9.35,0.11,1.19%,130373184.00,Israel,1997,6463,,
RDFN,Redfin Corporation Common Stock,$64.04,-1.51,-2.304%,6609340033.00,United States,2017,410133,,
RDHL,Redhill Biopharma Ltd. American Depositary Shares,$6.455,0.105,1.654%,2994791118.00,Israel,,79541,,
RDI,Reading International Inc Class A Common Stock,$5.84,-0.15,-2.504%,127319096.00,United States,,7570,,
RDIB,Reading International Inc Class B Common Stock,$19.1112,0.00,0.00%,416647380.00,United States,,4,,
RDNT,RadNet Inc. Common Stock,$22.415,-0.565,-2.459%,1171678942.00,United States,,12417,,
RDUS,Radius Health Inc. Common Stock,$21.36,0.16,0.755%,1009036553.00,United States,2014,46198,,
RDVT,Red Violet Inc. Common Stock ,$19.93,0.32,1.632%,243306975.00,United States,,1705,,
RDWR,Radware Ltd. Ordinary Shares,$27.31,-0.08,-0.292%,1243559211.00,Israel,1999,62279,,
REAL,The RealReal Inc. Common Stock,$24.62,0.26,1.067%,2211743116.00,United States,2019,216221,,
REDU,RISE Education Cayman Ltd American Depositary Shares,$3.34,-0.01,-0.299%,188652906.00,China,2017,6216,,
REED,Reeds Inc. Common Stock,$1.07,-0.37,-25.694%,92451553.00,United States,,19183346,,
REFR,Research Frontiers Incorporated Common Stock,$2.55,-0.06,-2.299%,80708510.00,United States,,17220,,
REG,Regency Centers Corporation Common Stock,$63.145,-0.285,-0.449%,10723849363.00,United States,1993,319026,,
REGI,Renewable Energy Group Inc. Common Stock,$59.505,0.305,0.515%,2695026912.00,United States,2012,314239,,
REGN,Regeneron Pharmaceuticals Inc. Common Stock,$485.30,0.12,0.025%,51695713813.00,United States,1991,132806,,
REKR,Rekor Systems Inc. Common Stock,$21.15,-1.14,-5.114%,863009232.00,United States,,278211,,
RELI,Reliance Global Group Inc. Common Stock,$3.36,-0.08,-2.326%,13984706.00,United States,,11374,,
RELIW,Reliance Global Group Inc. Series A Warrants,$0.6106,0.0206,3.492%,0.00,United States,,499,,
RELL,Richardson Electronics Ltd. Common Stock,$7.54,0.04,0.533%,99585711.00,United States,1983,23654,,
REPH,Recro Pharma Inc. Common Stock,$2.54,-0.05,-1.931%,78773830.00,United States,2014,48973,,
REPL,Replimune Group Inc. Common Stock,$36.53,4.00,12.296%,1698406350.00,United States,2018,137060,,
RESN,Resonant Inc. Common Stock,$3.00,-0.03,-0.99%,180780369.00,United States,2014,454039,,
RETA,Reata Pharmaceuticals Inc. Class A Common Stock,$92.55,0.55,0.598%,3350395609.00,United States,2016,53900,,
RETO,ReTo Eco-Solutions Inc. Common Shares,$1.1294,0.0294,2.673%,27258069.00,China,2017,34389,,
REVHU,Revolution Healthcare Acquisition Corp. SAIL Units,$10.20,0.00,0.00%,0.00,United States,2021,7585,,
REYN,Reynolds Consumer Products Inc. Common Stock,$30.18,-0.34,-1.114%,6330495957.00,United States,2020,285505,,
RFIL,RF Industries Ltd. Common Stock,$6.48,-0.02,-0.308%,64621515.00,United States,,948,,
RGCO,RGC Resources Inc. Common Stock,$21.63,-0.20,-0.916%,177699946.00,United States,,5574,,
RGEN,Repligen Corporation Common Stock,$196.55,1.88,0.966%,10790446015.00,United States,1986,56179,,
RGLD,Royal Gold Inc. Common Stock,$115.00,-0.40,-0.347%,7544747040.00,United States,,44116,,
RGLS,Regulus Therapeutics Inc. Common Stock,$1.0606,-0.0294,-2.697%,76898561.00,United States,2012,533469,,
RGNX,REGENXBIO Inc. Common Stock,$33.75,0.67,2.025%,1434547665.00,United States,2015,69125,,
RGP,Resources Connection Inc. Common Stock,$14.615,-0.075,-0.511%,479708467.00,United States,,24659,,
RIBT,RiceBran Technologies Common Stock,$0.9578,0.0223,2.384%,43363466.00,United States,,340221,,
RICK,RCI Hospitality Holdings Inc. Common Stock,$70.9149,-1.4951,-2.065%,638227718.00,United States,1995,7403,,
RIDE,Lordstown Motors Corp. Class A Common Stock,$8.8783,0.0383,0.433%,1464466023.00,United States,2019,990004,,
RIGL,Rigel Pharmaceuticals Inc. Common Stock,$3.44,0.00,0.00%,585214988.00,United States,2000,693969,,
RILY,B. Riley Financial Inc. Common Stock,$72.03,4.73,7.028%,1958849295.00,United States,,118466,,
RILYG,B. Riley Financial Inc. 7.25% Senior Notes due 2027,$25.33,0.0199,0.079%,0.00,United States,,3515,,
RILYH,B. Riley Financial Inc. 7.375% Senior Notes due 2023,$25.75,-0.005,-0.019%,0.00,United States,,1095,,
RILYI,B. Riley Financial Inc. 6.875% Senior Notes due 2023,$25.70,-0.05,-0.194%,0.00,United States,,5989,,
RILYK,B. Riley Financial Inc. 5.50% Senior Notes Due 2026,$25.10,0.01,0.04%,0.00,United States,,5105,,
RILYL,B. Riley Financial Inc. Depositary Shares each representing 1/1000th in a share of 7.375% Series B Cumulative Perpetual Preferred Stock par value $0.0001,$27.1501,-0.10,-0.367%,0.00,United States,,1434,,
RILYM,B. Riley Financial Inc. 6.375% Senior Notes due 2025,$25.8035,-0.0065,-0.025%,0.00,United States,,1008,,
RILYN,B. Riley Financial Inc. 6.50% Senior Notes Due 2026,$25.8994,-0.0006,-0.002%,0.00,United States,,11421,,
RILYO,B. Riley Financial Inc. 6.75% Senior Notes due 2024,$25.7501,0.00,0.00%,0.00,United States,,16,,
RILYP,B. Riley Financial Inc. Depositary Shares each representing a 1/1000th fractional interest in a share of Series A Cumulative Perpetual Preferred Stock,$26.9897,-0.3103,-1.137%,0.00,United States,,1493,,
RILYT,B. Riley Financial Inc. 6.00% Senior Notes Due 2028,$25.30,0.07,0.277%,0.00,United States,,6573,,
RIOT,Riot Blockchain Inc.  Common Stock ,$37.58,0.01,0.027%,3162159029.00,United States,,4251791,,
RIVE,Riverview Financial Corporation Common Stock,$10.11,0.00,0.00%,94495339.00,United States,,7,,
RKDA,Arcadia Biosciences Inc. Common Stock,$2.66,0.07,2.703%,56754422.00,United States,2015,472608,,
RLAY,Relay Therapeutics Inc. Common Stock,$31.08,0.33,1.073%,2810527135.00,United States,2020,80858,,
RLMD,Relmada Therapeutics Inc. Common Stock,$37.70,-0.20,-0.528%,631372795.00,United States,,4764,,
RMBI,Richmond Mutual Bancorporation Inc. Common Stock,$13.88,0.09,0.653%,180419652.00,United States,2019,21968,,
RMBL,RumbleOn Inc. Class B Common Stock,$38.00,-0.37,-0.964%,128936356.00,United States,,5687,,
RMBS,Rambus Inc. Common Stock,$18.92,-0.23,-1.201%,2128398892.00,United States,1997,152802,,
RMCF,Rocky Mountain Chocolate Factory Inc. Common Stock,$6.03,0.03,0.50%,36627987.00,United States,,13990,,
RMGB,RMG Acquisition Corp. II Class A Ordinary Shares,$9.99,-0.01,-0.10%,430818750.00,United States,2021,11999,,
RMGBU,RMG Acquisition Corp. II Unit,$10.42,0.02,0.192%,0.00,United States,2020,2240,,
RMGBW,RMG Acquisition Corp. II Warrant,$1.4699,0.0199,1.372%,0.00,United States,2021,3710,,
RMGC,RMG Acquisition Corp. III Class A Ordinary Shares,$9.86,-0.15,-1.499%,595297500.00,United States,2021,16600,,
RMGCU,RMG Acquisition Corp. III Unit,$10.05,0.00,0.00%,0.00,United States,2021,2109,,
RMGCW,RMG Acquisition Corp. III Warrant,$0.95,0.0901,10.478%,0.00,United States,2021,500,,
RMNI,Rimini Street Inc. (DE) Common Stock,$7.765,0.015,0.194%,659678223.00,United States,2015,60146,,
RMR,The RMR Group Inc. Class A Common Stock,$39.25,-0.85,-2.12%,643528909.00,United States,,10192,,
RMRM,RMR Mortgage Trust Common Stock,$12.15,-0.07,-0.573%,123954409.00,United States,,1676,,
RMTI,Rockwell Medical Inc. (DE) Common Stock,$0.90,-0.0037,-0.409%,84227202.00,United States,1998,277183,,
RNA,Avidity Biosciences Inc. Common Stock,$22.2305,-0.0195,-0.088%,835524450.00,United States,2020,34588,,
RNDB,Randolph Bancorp Inc. Common Stock,$20.11,-0.12,-0.593%,108450937.00,United States,2016,1288,,
RNLX,Renalytix AI plc American Depositary Shares,$30.16,0.28,0.937%,1086473073.00,United Kingdom,2020,2569,,
RNST,Renasant Corporation Common Stock,$44.46,0.19,0.429%,2502846623.00,United States,,31964,,
RNWK,RealNetworks Inc. Common Stock,$2.485,-0.065,-2.549%,95927088.00,United States,1997,482423,,
ROAD,Construction Partners Inc. Class A Common Stock,$32.535,-0.075,-0.23%,1685044424.00,United States,2018,65079,,
ROCC,Roth CH Acquisition II Co. Common Stock,$10.4096,-0.0004,-0.004%,152500640.00,United States,2021,16293,,
ROCCU,Roth CH Acquisition II Co. Unit,$11.11,-0.01,-0.09%,0.00,United States,2020,5202,,
ROCCW,Roth CH Acquisition II Co. Warrant,$1.85,0.10,5.714%,0.00,United States,2021,18385,,
ROCK,Gibraltar Industries Inc. Common Stock,$88.09,-3.13,-3.431%,2874309047.00,United States,1993,24650,,
ROCR,Roth CH Acquisition III Co. Common stock,$9.77,0.00,0.00%,144429910.00,United States,2021,3,,
ROCRU,Roth CH Acquisition III Co. Unit,$10.01,-0.01,-0.10%,0.00,United States,2021,200,,
ROCRW,Roth CH Acquisition III Co. Warrant,$1.10,0.00,0.00%,0.00,United States,2021,6,,
ROIC,Retail Opportunity Investments Corp. Common Stock (MD),$17.37,-0.32,-1.809%,2058622520.00,United States,,129663,,
ROKU,Roku Inc. Class A Common Stock,$315.08,-4.51,-1.411%,41714451346.00,United States,2017,1105315,,
ROLL,RBC Bearings Incorporated Common Stock,$201.70,-0.38,-0.188%,5070664380.00,United States,2005,4371,,
ROOT,Root Inc. Class A Common Stock,$10.677,0.177,1.686%,2687348988.00,United States,2020,321406,,
ROST,Ross Stores Inc. Common Stock,$130.98,-1.01,-0.765%,46708967852.00,United States,1985,426905,,
RPAY,Repay Holdings Corporation Class A Common Stock,$22.24,-0.07,-0.314%,1789258841.00,United States,2018,80400,,
RPD,Rapid7 Inc. Common Stock,$77.17,-0.81,-1.039%,4251433743.00,United States,2015,73444,,
RPHM,Reneo Pharmaceuticals Inc. Common Stock,$14.54,-0.11,-0.751%,352023563.00,United States,2021,17828,,
RPRX,Royalty Pharma plc Class A Ordinary Shares ,$42.24,-0.22,-0.518%,25644363149.00,United States,2020,140570,,
RPTX,Repare Therapeutics Inc. Common Shares,$32.72,0.14,0.43%,1210096848.00,Canada,2020,22115,,
RRBI,Red River Bancshares Inc. Common Stock,$55.30,-0.01,-0.018%,404162096.00,United States,2019,1767,,
RRGB,Red Robin Gourmet Burgers Inc. Common Stock,$34.60,-0.96,-2.70%,539090455.00,United States,2002,31400,,
RRR,Red Rock Resorts Inc. Class A Common Stock,$37.62,0.37,0.993%,4401540000.00,United States,2016,332639,,
RSSS,Research Solutions Inc Common Stock,$2.19,0.00,0.00%,57548117.00,United States,,484,,
RSVA,Rodgers Silicon Valley Acquisition Corp. Common Stock,$13.55,-0.06,-0.441%,389562500.00,United States,2021,18721,,
RSVAU,Rodgers Silicon Valley Acquisition Corp. Unit,$16.1795,0.00,0.00%,0.00,United States,2020,50,,
RSVAW,Rodgers Silicon Valley Acquisition Corp. Warrant,$4.455,0.095,2.179%,0.00,United States,2021,510,,
RTLR,Rattler Midstream LP Common Units,$11.28,0.07,0.624%,1685538579.00,United States,2019,34835,,
RTPYU,Reinvent Technology Partners Y Unit,$10.1399,0.0499,0.495%,0.00,United States,2021,1271,,
RUBY,Rubius Therapeutics Inc. Common Stock,$25.43,1.34,5.562%,2239836865.00,United States,2018,82908,,
RUN,Sunrun Inc. Common Stock,$43.12,-0.28,-0.645%,8787826980.00,United States,2015,2382672,,
RUSHA,Rush Enterprises Inc. Common Stock Cl A,$49.80,-0.20,-0.40%,2766150263.00,United States,,15362,,
RUSHB,Rush Enterprises Inc. Class B,$45.40,0.39,0.866%,2521751444.00,United States,,148,,
RUTH,Ruth's Hospitality Group Inc. Common Stock,$26.44,-0.61,-2.255%,925767225.00,United States,2005,98539,,
RVMD,Revolution Medicines Inc. Common Stock,$31.46,-0.03,-0.095%,2308635661.00,United States,2020,92826,,
RVNC,Revance Therapeutics Inc. Common Stock,$28.28,0.29,1.036%,2018708242.00,United States,2014,66871,,
RVPH,Reviva Pharmaceuticals Holdings Inc. Common Stock ,$5.51,-0.53,-8.775%,28291387.00,United States,2020,46918,,
RVPHW,Reviva Pharmaceuticals Holdings Inc. Warrants,$0.46,-0.01,-2.128%,0.00,United States,2018,20186,,
RVSB,Riverview Bancorp Inc Common Stock,$6.845,-0.075,-1.084%,152953134.00,United States,,8003,,
RWLK,ReWalk Robotics Ltd. Ordinary Shares,$1.77,-0.05,-2.747%,81612928.00,Israel,2014,164964,,
RXDX,Prometheus Biosciences Inc. Common Stock,$23.40,0.52,2.273%,906850152.00,United States,2021,5624,,
RXRA,RXR Acquisition Corp. Class A Common Stock,$9.70,-0.05,-0.513%,0.00,United States,2021,200,,
RXRAU,RXR Acquisition Corp. Units,$10.015,0.00,0.00%,0.00,United States,2021,15,,
RXRAW,RXR Acquisition Corp. Warrants to purchase Class A common stock,$0.95,-0.09,-8.654%,0.00,United States,2021,24280,,
RXRX,Recursion Pharmaceuticals Inc. Class A Common Stock,$32.88,-0.54,-1.616%,5451224191.00,United States,2021,19454,,
RXT,Rackspace Technology Inc. Common Stock,$23.86,-0.08,-0.334%,4919387682.00,United States,2020,82900,,
RYAAY,Ryanair Holdings plc American Depositary Shares,$116.595,0.305,0.262%,26305278361.00,Ireland,1997,94369,,
RYTM,Rhythm Pharmaceuticals Inc. Common Stock,$22.34,0.81,3.762%,1121507274.00,United States,2017,61958,,
RZLT,Rezolute Inc. Common Stock,$6.985,-0.015,-0.214%,58340655.00,United States,,22841,,
SABR,Sabre Corporation Common Stock,$12.74,-0.17,-1.317%,4042848830.00,United States,2014,6745394,,
SABRP,Sabre Corporation 6.50% Series A Mandatory Convertible Preferred Stock,$164.59,-2.39,-1.431%,,United States,,210331,,
SAFM,Sanderson Farms Inc. Common Stock,$166.94,-1.21,-0.72%,3727835974.00,United States,1987,18569,,
SAFT,Safety Insurance Group Inc. Common Stock,$82.07,-1.25,-1.50%,1229654646.00,United States,2002,8800,,
SAGE,Sage Therapeutics Inc. Common Stock,$72.10,0.96,1.349%,4209337369.00,United States,2014,90275,,
SAIA,Saia Inc. Common Stock,$237.18,1.29,0.547%,6244875637.00,United States,,14513,,
SAII,Software Acquisition Group Inc. II Class A Common Stock,$10.00,0.00,0.00%,215625000.00,United States,2020,8263,,
SAIIU,Software Acquisition Group Inc. II Unit,$10.82,0.00,0.00%,0.00,United States,2020,1100,,
SAIIW,Software Acquisition Group Inc. II Warrant,$1.68,-0.07,-4.00%,0.00,United States,2020,8025,,
SAL,Salisbury Bancorp Inc. Common Stock,$48.30,0.55,1.152%,137420600.00,United States,,2256,,
SALM,Salem Media Group Inc. Class A Common Stock,$1.94,-0.01,-0.513%,52079758.00,United States,1999,10877,,
SAMG,Silvercrest Asset Management Group Inc. Class A Common Stock,$14.2865,0.0665,0.468%,206153224.00,United States,2013,5340,,
SANA,Sana Biotechnology Inc. Common Stock,$19.14,-0.02,-0.104%,3588862103.00,United States,2021,56927,,
SANM,Sanmina Corporation Common Stock,$40.84,0.57,1.415%,2651601078.00,United States,1993,64224,,
SANW,S&W Seed Company Common Stock (NV),$3.9496,0.0396,1.013%,138549381.00,United States,,6076,,
SASR,Sandy Spring Bancorp Inc. Common Stock,$46.58,-0.45,-0.957%,2197988580.00,United States,,32070,,
SATS,EchoStar  Corporation Common Stock,$23.93,-0.05,-0.209%,2224183901.00,United States,,78830,,
SAVA,Cassava Sciences Inc. Common Stock,$42.535,1.385,3.366%,1697075254.00,United States,,278083,,
SBAC,SBA Communications Corporation Class A Common Stock,$292.60,-4.30,-1.448%,31990250600.00,United States,1999,77932,,
SBBP,Strongbridge Biopharma plc Ordinary Shares,$2.49,-0.05,-1.969%,168187969.00,United States,2015,60030,,
SBCF,Seacoast Banking Corporation of Florida Common Stock,$37.82,0.05,0.132%,2091219080.00,United States,,48319,,
SBEA,SilverBox Engaged Merger Corp I Class A Common Stock,$9.8099,0.00,0.00%,0.00,United States,2021,61,,
SBEAU,SilverBox Engaged Merger Corp I Units,$10.05,0.01,0.10%,0.00,United States,2021,77116,,
SBFG,SB Financial Group Inc. Common Stock,$18.17,0.16,0.888%,132041335.00,United States,,9506,,
SBGI,Sinclair Broadcast Group Inc. Class A Common Stock,$32.79,1.40,4.46%,2470656723.00,United States,1995,171673,,
SBLK,Star Bulk Carriers Corp. Common Shares,$21.32,0.89,4.356%,2115790745.00,Greece,,541512,,
SBLKZ,Star Bulk Carriers Corp. 8.30% Senior Notes due 2022,$25.66,0.00,0.00%,0.00,Greece,,372,,
SBNY,Signature Bank Common Stock,$256.965,3.165,1.247%,14807585255.00,United States,2004,72398,,
SBNYP,Signature Bank Depositary shares each representing a 1/40th ownership interest in a share of 5.000% Noncumulative Perpetual Series A Preferred Stock,$25.69,-0.01,-0.039%,0.00,United States,,636,,
SBRA,Sabra Health Care REIT Inc. Common Stock,$17.335,-0.445,-2.503%,3743150052.00,United States,,519109,,
SBSI,Southside Bancshares Inc. Common Stock,$41.09,-0.21,-0.508%,1341958310.00,United States,,6333,,
SBT,Sterling Bancorp Inc. Common Stock,$4.84,0.00,0.00%,241912207.00,United States,2017,2352,,
SBTX,Silverback Therapeutics Inc. Common Stock,$29.735,0.615,2.112%,1037855483.00,United States,2020,22685,,
SBUX,Starbucks Corporation Common Stock,$113.49,-0.62,-0.543%,133725267000.00,United States,1992,1424209,,
SCAQ,Stratim Cloud Acquisition Corp. Class A Common Stock,$9.78,-0.02,-0.204%,0.00,United States,2021,105,,
SCAQU,Stratim Cloud Acquisition Corp. Unit,$10.00,0.00,0.00%,0.00,United States,2021,110,,
SCAQW,Stratim Cloud Acquisition Corp. Warrant,$1.17,0.00,0.00%,0.00,United States,2021,400,,
SCHL,Scholastic Corporation Common Stock,$31.055,0.125,0.404%,1066060108.00,United States,1992,16226,,
SCHN,Schnitzer Steel Industries Inc. Class A Common Stock,$54.4199,1.7799,3.381%,1494622581.00,United States,1993,126074,,
SCKT,Socket Mobile Inc. Common Stock,$6.04,0.16,2.721%,41925959.00,United States,,65416,,
SCLE,Broadscale Acquisition Corp. Class A common stock,$9.77,0.02,0.205%,0.00,United States,2021,100220,,
SCLEU,Broadscale Acquisition Corp. Units,$9.98,0.00,0.00%,0.00,United States,2021,370,,
SCLEW,Broadscale Acquisition Corp. Warrant,$0.95,-0.04,-4.04%,0.00,United States,2021,5936,,
SCOA,ScION Tech Growth I Class A Ordinary Shares,$9.85,-0.05,-0.505%,0.00,United Kingdom,2021,2924,,
SCOAU,ScION Tech Growth I Unit,$10.13,0.02,0.198%,0.00,United Kingdom,2020,105,,
SCOAW,ScION Tech Growth I Warrant,$0.84,0.00,0.00%,0.00,United Kingdom,2021,3601,,
SCOB,ScION Tech Growth II Class A Ordinary Shares,$9.83,0.00,0.00%,423918750.00,United Kingdom,2021,1,,
SCOBU,ScION Tech Growth II Units,$10.07,-0.01,-0.099%,0.00,United Kingdom,2021,2006,,
SCOBW,ScION Tech Growth II Warrants,$0.71,0.00,0.00%,0.00,United Kingdom,2021,4362,,
SCOR,comScore Inc. Common Stock,$3.61,-0.07,-1.902%,289885054.00,United States,2018,63625,,
SCPH,scPharmaceuticals Inc. Common Stock,$6.11,0.05,0.825%,166924949.00,United States,2017,41148,,
SCPL,SciPlay Corporation Class A Common Stock,$17.50,0.26,1.508%,426710795.00,United States,2019,97396,,
SCPS,Scopus BioPharma Inc. Common Stock,$6.895,0.145,2.148%,108441781.00,United States,2020,1742,,
SCR,Score Media and Gaming Inc. Class A Subordinate Voting Shares,$17.85,-0.08,-0.446%,898624781.00,Canada,,65844,,
SCSC,ScanSource Inc. Common Stock,$31.125,0.075,0.242%,792186217.00,United States,,9592,,
SCVL,Shoe Carnival Inc. Common Stock,$62.51,0.38,0.612%,881737993.00,United States,1993,11722,,
SCWX,SecureWorks Corp. Class A Common Stock,$13.385,0.295,2.254%,1111346632.00,United States,2016,20587,,
SCYX,SCYNEXIS Inc. Common Stock,$7.39,-0.12,-1.598%,152461243.00,United States,2014,143896,,
SDAC,Sustainable Development Acquisition I Corp. Class A Common Stock,$9.79,-0.11,-1.111%,387010938.00,United States,2021,1449,,
SDACU,Sustainable Development Acquisition I Corp. Unit,$10.19,-0.03,-0.294%,0.00,United States,2021,4923,,
SDACW,Sustainable Development Acquisition I Corp. Warrant,$0.7006,-0.0494,-6.587%,0.00,United States,2021,22794,,
SDC,SmileDirectClub Inc. Class A Common Stock,$8.75,0.14,1.626%,3389940759.00,United States,2019,2143820,,
SDGR,Schrodinger Inc. Common Stock,$69.53,-0.70,-0.997%,4867954246.00,United States,2020,260424,,
SDH,Global Internet of People Inc. Ordinary Shares,$3.081,-0.099,-3.113%,72465120.00,China,2021,45523,,
SEAC,SeaChange International Inc. Common Stock,$1.06,-0.03,-2.752%,51029337.00,United States,1996,550564,,
SECO,Secoo Holding Limited ADR,$2.55,0.07,2.823%,180164033.00,China,2017,51674,,
SEDG,SolarEdge Technologies Inc. Common Stock,$224.26,5.69,2.603%,11656159065.00,Israel,2015,656207,,
SEED,Origin Agritech Limited Common Stock,$13.98,-0.22,-1.549%,79491301.00,China,,6712,,
SEEL,Seelos Therapeutics Inc. Common Stock,$5.82,-0.02,-0.342%,455607182.00,United States,,507821,,
SEER,Seer Inc. Class A Common Stock,$41.71,-0.09,-0.215%,2540599937.00,United States,2020,78330,,
SEIC,SEI Investments Company Common Stock,$62.80,0.44,0.706%,8968452865.00,United States,1981,110445,,
SELB,Selecta Biosciences Inc. Common Stock,$3.08,0.04,1.316%,346109453.00,United States,2016,328337,,
SELF,Global Self Storage Inc. Common Stock,$4.99,0.00,0.00%,46687448.00,United States,,2547,,
SENEA,Seneca Foods Corp. Class A Common Stock,$46.95,-0.02,-0.043%,425751427.00,United States,,3019,,
SENEB,Seneca Foods Corp. Class B Common Stock,$48.50,0.00,0.00%,439807118.00,United States,,105,,
SESN,Sesen Bio Inc. Common Stock,$2.96,0.06,2.069%,501383229.00,United States,2014,1546100,,
SFBC,Sound Financial Bancorp Inc. Common Stock,$38.45,-0.28,-0.723%,100006681.00,United States,,1893,,
SFBS,ServisFirst Bancshares Inc. Common Stock,$65.995,-0.035,-0.053%,3572814212.00,United States,2014,46725,,
SFET,Safe-T Group Ltd. American Depositary Share,$1.3101,-0.0299,-2.231%,34219653.00,Israel,2018,28475,,
SFIX,Stitch Fix Inc. Class A Common Stock,$41.375,-1.275,-2.989%,4400050276.00,United States,2017,489930,,
SFM,Sprouts Farmers Market Inc. Common Stock,$25.675,-0.415,-1.591%,3034645739.00,United States,2013,284411,,
SFNC,Simmons First National Corporation Class A Common Stock,$29.49,0.15,0.511%,3195115637.00,United States,,50300,,
SFST,Southern First Bancshares Inc. Common Stock,$53.17,0.21,0.397%,416921017.00,United States,,2248,,
SFT,Shift Technologies Inc. Class A Common Stock,$9.0799,0.1799,2.021%,763962411.00,United States,2019,433094,,
SGA,Saga Communications Inc. Class A Common Stock (FL),$22.39,0.35,1.588%,133900999.00,United States,,7978,,
SGAM,Seaport Global Acquisition Corp. Class A Common Stock,$9.88,-0.01,-0.101%,177531250.00,United States,2020,500,,
SGAMU,Seaport Global Acquisition Corp. Unit,$10.51,0.23,2.237%,0.00,United States,2020,110,,
SGAMW,Seaport Global Acquisition Corp. Warrant,$0.6164,0.0264,4.475%,0.00,United States,2020,3113,,
SGBX,SG Blocks Inc. Common Stock,$3.42,-0.04,-1.156%,30168808.00,United States,2017,39107,,
SGC,Superior Group of Companies Inc. Common Stock,$26.04,-0.41,-1.55%,404746308.00,United States,,8898,,
SGEN,Seagen Inc. Common Stock,$136.875,0.685,0.503%,24839674778.00,United States,2001,97816,,
SGH,SMART Global Holdings Inc. Ordinary Shares,$46.48,0.80,1.751%,1108560736.00,United States,2017,48748,,
SGLB,Sigma Labs Inc. Common Stock,$3.5501,-0.0599,-1.659%,20697083.00,United States,,88675,,
SGLBW,Sigma Labs Inc. Warrant,$0.27,0.02,8.00%,0.00,United States,,5504,,
SGMA,SigmaTron International Inc. Common Stock,$5.0701,0.0201,0.398%,21585991.00,United States,1994,1922,,
SGMO,Sangamo Therapeutics Inc. Common Stock,$10.85,-0.51,-4.489%,1559291746.00,United States,2000,417976,,
SGMS,Scientific Games Corp Common Stock,$56.82,0.73,1.301%,5456918195.00,United States,,63567,,
SGOC,SGOCO Group Ltd Ordinary Shares (Cayman Islands),$1.67,0.00,0.00%,167999740.00,China,2010,8458,,
SGRP,SPAR Group Inc. Common Stock,$1.66,-0.0199,-1.185%,35280782.00,United States,,6125,,
SGRY,Surgery Partners Inc. Common Stock,$49.80,0.41,0.83%,2998009053.00,United States,2015,71301,,
SGTX,Sigilon Therapeutics Inc. Common Stock,$13.61,0.56,4.291%,428614545.00,United States,2020,29436,,
SHAC,SCP & CO Healthcare Acquisition Company Class A Common Stock,$9.77,0.00,0.00%,280887500.00,United States,2021,1,,
SHACU,SCP & CO Healthcare Acquisition Company Unit,$10.04,0.00,0.00%,0.00,United States,2021,1,,
