Symbol,Name,Last Sale,Net Change,% Change,Market Cap,Country,IPO Year,Volume,Sector,Industry
AACG,ATA Creativity Global American Depositary Shares,$3.00,0.10,3.448%,95103564.00,China,,21164,Miscellaneous,Service to the Health Industry
AACQ,Artius Acquisition Inc. Class A Common Stock,$10.07,-0.03,-0.297%,911964375.00,United States,2020,57051,Finance,Business Services
AACQU,Artius Acquisition Inc. Unit ,$10.74,-0.01,-0.093%,0.00,United States,2020,766,Finance,Business Services
AACQW,Artius Acquisition Inc Warrant,$1.9129,-0.0371,-1.903%,0.00,United States,2020,78583,Finance,Business Services
AAL,American Airlines Group Inc. Common Stock,$21.5774,0.1574,0.735%,13839380198.00,United States,,10759072,Transportation,Air Freight/Delivery Services
AAME,Atlantic American Corporation Common Stock,$4.17,0.11,2.709%,85131563.00,United States,,85573,Finance,Life Insurance
AAOI,Applied Optoelectronics Inc. Common Stock,$7.17,-0.09,-1.24%,191435752.00,United States,2013,171501,Technology,Semiconductors
AAON,AAON Inc. Common Stock,$63.08,-0.98,-1.53%,3306111049.00,United States,,23198,Capital Goods,Industrial Machinery/Components
AAPL,Apple Inc. Common Stock,$129.77,1.92,1.502%,2249866611800.00,United States,1980,33806367,Technology,Computer Manufacturing
AAWW,Atlas Air Worldwide Holdings NEW Common Stock,$68.315,-1.325,-1.903%,1981614845.00,United States,,221055,Transportation,Transportation Services
ABCB,Ameris Bancorp Common Stock,$56.04,0.18,0.322%,3906740393.00,United States,1994,51691,Finance,Major Banks
ABCL,AbCellera Biologics Inc. Common Shares,$29.555,1.555,5.554%,7965006533.00,Canada,2020,411380,,
ABCM,Abcam plc American Depositary Shares,$20.93,-0.05,-0.238%,4745351613.00,United Kingdom,2020,23978,Health Care,Biotechnology: Biological Products (No Diagnostic Substances)
ABEO,Abeona Therapeutics Inc. Common Stock,$1.7401,0.0351,2.059%,172337647.00,United States,,739459,Health Care,Major Pharmaceuticals
ABGI,ABG Acquisition Corp. I Class A Ordinary Shares,$9.98,0.00,0.00%,192938849.00,United States,2021,54,Finance,Business Services
ABIO,ARCA biopharma Inc. Common Stock,$3.36,0.07,2.128%,48418080.00,United States,,56137,Health Care,Biotechnology: In Vitro & In Vivo Diagnostic Substances
ABMD,ABIOMED Inc. Common Stock,$301.40,-3.60,-1.18%,13644663727.00,United States,,37706,Health Care,Medical/Dental Instruments
ABNB,Airbnb Inc. Class A Common Stock,$168.00,-0.90,-0.533%,100195033176.00,United States,2020,884340,Capital Goods,Industrial Machinery/Components
ABST,Absolute Software Corporation Common Stock,$14.12,-0.11,-0.773%,693528609.00,Canada,2020,30608,,
ABTX,Allegiance Bancshares Inc. Common Stock,$40.91,0.03,0.073%,825030661.00,United States,2015,5980,Finance,Major Banks
ABUS,Arbutus Biopharma Corporation Common Stock,$3.045,-0.285,-8.559%,296888572.00,Canada,,919361,,
ACAC,Acies Acquisition Corp. Class A Ordinary Share,$9.95,-0.01,-0.10%,267717188.00,United States,2020,13611,Finance,Business Services
ACACU,Acies Acquisition Corp. Unit,$10.4363,-0.0687,-0.654%,0.00,United States,2020,1999,Finance,Business Services
ACACW,Acies Acquisition Corp. Warrant,$1.80,-0.045,-2.439%,0.00,United States,2020,2400,Finance,Business Services
ACAD,ACADIA Pharmaceuticals Inc. Common Stock,$19.3499,-0.1701,-0.871%,3099438596.00,United States,1985,463272,Health Care,Major Pharmaceuticals
ACAH,Atlantic Coastal Acquisition Corp. Class A Common Stock,$9.72,0.00,0.00%,0.00,United States,2021,324,,
ACAHU,Atlantic Coastal Acquisition Corp. Unit,$9.9398,-0.0002,-0.002%,0.00,United States,2021,4432,,
ACAHW,Atlantic Coastal Acquisition Corp. Warrant,$0.68,-0.02,-2.857%,0.00,United States,2021,3002,,
ACBAU,Ace Global Business Acquisition Limited Unit,$10.16,0.00,0.00%,0.00,Hong Kong,2021,15,,
ACBI,Atlantic Capital Bancshares Inc. Common Stock,$26.93,-0.12,-0.444%,548135294.00,United States,,11189,Finance,Major Banks
ACCD,Accolade Inc. Common Stock,$46.37,0.16,0.346%,2714672899.00,United States,2020,103954,,
ACER,Acer Therapeutics Inc. Common Stock (DE),$2.72,-0.04,-1.449%,38923864.00,United States,,26908,Health Care,Biotechnology: Biological Products (No Diagnostic Substances)
ACET,Adicet Bio Inc. Common Stock ,$14.86,-0.15,-0.999%,291104844.00,United States,2018,13361,Health Care,Major Pharmaceuticals
ACEV,ACE Convergence Acquisition Corp. Class A Ordinary Shares,$10.034,0.074,0.743%,288477500.00,United States,2020,153449,Technology,Semiconductors
ACEVU,ACE Convergence Acquisition Corp. Unit,$11.23,0.33,3.028%,0.00,United States,2020,1325,Technology,Semiconductors
ACEVW,ACE Convergence Acquisition Corp. Warrant,$1.95,0.00,0.00%,0.00,United States,2020,31576,Technology,Semiconductors
ACGL,Arch Capital Group Ltd. Common Stock,$39.26,-1.00,-2.484%,15834083181.00,Bermuda,,537243,Finance,Property-Casualty Insurers
ACGLO,Arch Capital Group Ltd. Depositary Shares Each Representing 1/1000th Interest in a Share of 5.45% Non-Cumulative Preferred Shares Series F,$26.37,0.03,0.114%,0.00,Bermuda,,7182,Finance,Property-Casualty Insurers
ACGLP,Arch Capital Group Ltd. Depositary Shares Representing Interest in 5.25% Non-Cumulative Preferred Series E Shrs,$25.50,0.01,0.039%,0.00,Bermuda,,10843,Finance,Property-Casualty Insurers
ACHC,Acadia Healthcare Company Inc. Common Stock,$61.475,-0.805,-1.293%,5496572885.00,United States,,26599,Health Care,Hospital/Nursing Management
ACHL,Achilles Therapeutics plc American Depositary Shares,$16.29,0.89,5.779%,661728324.00,United Kingdom,2021,1956,Health Care,Biotechnology: Biological Products (No Diagnostic Substances)
ACHV,Achieve Life Sciences Inc. Common Shares,$10.2517,-0.0383,-0.372%,63047104.00,United States,,4501,Health Care,Biotechnology: In Vitro & In Vivo Diagnostic Substances
ACIU,AC Immune SA Common Stock,$6.3859,0.2259,3.667%,463952583.00,Switzerland,2016,14987,Health Care,Major Pharmaceuticals
ACIW,ACI Worldwide Inc. Common Stock,$37.07,-0.69,-1.827%,4379172479.00,United States,,87837,Technology,EDP Services
ACKIT,Ackrell SPAC Partners I Co. Subunits,$9.97,-0.005,-0.05%,0.00,United States,2021,16295,,
ACKIU,Ackrell SPAC Partners I Co. Units,$10.29,0.06,0.587%,0.00,United States,2020,175,,
ACKIW,Ackrell SPAC Partners I Co. Warrants,$0.60,0.00,0.00%,0.00,United States,2021,10,Finance,Business Services
ACLS,Axcelis Technologies Inc. Common Stock,$38.70,-2.10,-5.147%,1307075433.00,United States,2000,225865,Technology,Industrial Machinery/Components
ACMR,ACM Research Inc. Class A Common Stock,$75.87,1.29,1.73%,1444021116.00,United States,2017,85389,Technology,Industrial Machinery/Components
ACNB,ACNB Corporation Common Stock,$28.62,0.19,0.668%,249423872.00,United States,,1999,Finance,Major Banks
ACOR,Acorda Therapeutics Inc. Common Stock,$4.9865,0.0465,0.941%,47317058.00,United States,2006,14910,Health Care,Biotechnology: Biological Products (No Diagnostic Substances)
ACQRU,Independence Holdings Corp. Units,$10.19,0.13,1.292%,0.00,United States,2021,35050,Finance,Business Services
ACRS,Aclaris Therapeutics Inc. Common Stock,$24.00,0.33,1.394%,1250036520.00,United States,2015,63249,Health Care,Major Pharmaceuticals
ACRX,AcelRx Pharmaceuticals Inc. Common Stock,$1.17,0.00,0.00%,139350509.00,United States,2011,330005,Consumer Durables,Specialty Chemicals
ACST,Acasti Pharma Inc. Class A Common Stock,$0.435,-0.0116,-2.597%,42148254.00,Canada,,2031218,,
ACTC,ArcLight Clean Transition Corp. Class A Ordinary Shares,$15.9192,0.5292,3.439%,552197250.00,United States,2020,250116,Finance,Business Services
ACTCU,ArcLight Clean Transition Corp. Unit,$17.0801,-0.9899,-5.478%,0.00,United States,2020,2472,Finance,Business Services
ACTCW,ArcLight Clean Transition Corp. Warrant,$4.60,0.23,5.263%,0.00,United States,2020,113668,Finance,Business Services
ACTDU,ArcLight Clean Transition Corp. II Unit,$10.11,-0.03,-0.296%,0.00,United States,2021,30274,,
ACTG,Acacia Research Corporation (Acacia Tech) Common Stock,$5.80,-0.09,-1.528%,285820827.00,United States,,82856,Miscellaneous,Multi-Sector Companies
ACVA,ACV Auctions Inc. Class A Common Stock,$33.16,0.08,0.242%,5111649249.00,United States,2021,26215,Technology,EDP Services
ADAG,Adagene Inc. American Depositary Shares,$13.635,-0.055,-0.402%,593366648.00,China,2021,2525,Health Care,Major Pharmaceuticals
ADAP,Adaptimmune Therapeutics plc American Depositary Shares,$5.35,0.00,0.00%,831821750.00,United Kingdom,2015,127281,Health Care,Major Pharmaceuticals
ADBE,Adobe Inc. Common Stock,$494.62,3.92,0.799%,236428360000.00,United States,1986,392818,Technology,Computer Software: Prepackaged Software
ADER,26 Capital Acquisition Corp. Class A Common Stock,$9.79,0.00,0.00%,336531250.00,United States,2021,1,,
ADERU,26 Capital Acquisition Corp. Unit,$10.15,-0.01,-0.098%,0.00,United States,2021,181,,
ADERW,26 Capital Acquisition Corp. Warrant,$0.85,0.03,3.659%,0.00,United States,2021,702,Finance,Business Services
ADES,Advanced Emissions Solutions Inc. Common Stock,$4.75,0.02,0.423%,89601635.00,United States,,26284,Basic Industries,Industrial Specialties
ADI,Analog Devices Inc. Common Stock,$153.90,1.99,1.31%,56851208192.00,United States,,1216468,Technology,Semiconductors
ADIL,Adial Pharmaceuticals Inc Common Stock,$2.34,0.04,1.739%,40958241.00,United States,2018,23350,Health Care,Major Pharmaceuticals
ADILW,Adial Pharmaceuticals Inc Warrant,$0.68,0.00,0.00%,0.00,United States,2018,1,,
ADMA,ADMA Biologics Inc Common Stock,$1.835,-0.015,-0.811%,225787540.00,United States,,1072297,Health Care,Major Pharmaceuticals
ADMP,Adamis Pharmaceuticals Corporation Common Stock,$0.86,-0.21,-19.626%,128042081.00,United States,,15918888,Health Care,Major Pharmaceuticals
ADMS,Adamas Pharmaceuticals Inc. Common Stock,$5.65,0.22,4.052%,256555737.00,United States,2014,151743,Health Care,Major Pharmaceuticals
ADN,Advent Technologies Holdings Inc. Class A Common Stock,$12.2862,0.2062,1.707%,251107911.00,United States,2018,113854,,
ADNWW,Advent Technologies Holdings Inc. Warrant,$1.73,0.05,2.976%,0.00,United States,2018,13500,,
ADOC,Edoc Acquisition Corp. Class A Ordinary Share,$10.05,0.00,0.00%,118630200.00,United States,2020,2994,Finance,Business Services
ADOCR,Edoc Acquisition Corp. Right,$0.43,-0.0086,-1.961%,0.00,United States,2020,2593,Finance,Business Services
ADOCW,Edoc Acquisition Corp. Warrant,$0.3149,0.016,5.353%,0.00,United States,2020,2389,Finance,Business Services
ADP,Automatic Data Processing Inc. Common Stock,$193.89,-0.08,-0.041%,82503747065.00,United States,,600121,Miscellaneous,Business Services
ADPT,Adaptive Biotechnologies Corporation Common Stock,$35.91,-0.37,-1.02%,5027552653.00,United States,2019,232805,Health Care,Biotechnology: Biological Products (No Diagnostic Substances)
ADSK,Autodesk Inc. Common Stock,$280.47,0.74,0.265%,61589050698.00,United States,,125912,Technology,Computer Software: Prepackaged Software
ADTN,ADTRAN Inc. Common Stock,$17.23,0.28,1.652%,835392139.00,United States,1994,39445,Capital Goods,Telecommunications Equipment
ADTX,ADiTx Therapeutics Inc. Common Stock,$2.74,-0.03,-1.083%,39703282.00,United States,2020,83441,Consumer Durables,Specialty Chemicals
ADUS,Addus HomeCare Corporation Common Stock,$95.81,-3.02,-3.056%,1516316270.00,United States,2009,31669,Health Care,Medical/Nursing Services
ADV,Advantage Solutions Inc. Class A Common Stock,$12.625,0.035,0.278%,4020430821.00,United States,2019,46995,Technology,Advertising
ADVM,Adverum Biotechnologies Inc. Common Stock,$3.70,0.09,2.493%,362329722.00,United States,2014,1640797,Health Care,Major Pharmaceuticals
ADVWW,Advantage Solutions Inc. Warrant,$3.40,0.09,2.719%,0.00,United States,2019,6243,Technology,Advertising
ADXN,Addex Therapeutics Ltd American Depositary Shares,$9.86,0.1255,1.289%,71611573.00,Switzerland,,427,Health Care,Major Pharmaceuticals
ADXS,Advaxis Inc. Common Stock,$0.4526,0.011,2.491%,62441134.00,United States,,2048083,Health Care,Major Pharmaceuticals
AEAC,Authentic Equity Acquisition Corp. Class A ordinary share,$9.72,0.00,0.00%,223560000.00,United States,2021,31,Finance,Business Services
AEACU,Authentic Equity Acquisition Corp. Unit,$10.07,0.00,0.00%,0.00,United States,2021,62,Finance,Business Services
AEACW,Authentic Equity Acquisition Corp. Warrant,$0.66,0.00,0.00%,0.00,United States,2021,250,Finance,Business Services
AEGN,Aegion Corp Common Stock,$29.98,-0.03,-0.10%,921609754.00,United States,,5292,Basic Industries,Water Supply
AEHL,Antelope Enterprise Holdings Limited Common Stock (0.024 par),$2.79,0.07,2.574%,10312554.00,China,,156161,Capital Goods,Building Products
AEHR,Aehr Test Systems Common Stock,$2.27,-0.12,-5.021%,53566847.00,United States,1997,65444,Capital Goods,Electrical Products
AEI,Alset EHome International Inc. Common Stock,$8.83,-0.93,-9.529%,75761400.00,United States,2020,204714,Consumer Services,Building operators
AEIS,Advanced Energy Industries Inc. Common Stock,$94.19,-9.05,-8.766%,3614609538.00,United States,1995,194594,Consumer Durables,Electrical Products
AEMD,Aethlon Medical Inc. Common Stock,$1.7701,-0.0399,-2.204%,21473582.00,United States,,11401,Miscellaneous,Diversified Commercial Services
AEP,American Electric Power Company Inc. Common Stock,$87.01,-1.37,-1.55%,43483282304.00,United States,,347710,Public Utilities,Electric Utilities: Central
AEPPL,American Electric Power Company Inc. Corporate Unit,$49.67,-0.45,-0.898%,0.00,United States,,4430,Public Utilities,Electric Utilities: Central
AEPPZ,American Electric Power Company Inc. Corporate Units,$50.73,-0.61,-1.188%,0.00,United States,,939,Public Utilities,Electric Utilities: Central
AERI,Aerie Pharmaceuticals Inc. Common Stock,$16.76,-0.18,-1.063%,785877925.00,United States,2013,135792,Health Care,Biotechnology: Biological Products (No Diagnostic Substances)
AESE,Allied Esports Entertainment Inc. Common Stock,$2.51,0.03,1.21%,98240150.00,United States,2017,255483,Consumer Services,Television Services
AEY,ADDvantage Technologies Group Inc. Common Stock,$2.00,0.005,0.251%,24733186.00,United States,,9223,Capital Goods,Recreational Products/Toys
AEYE,AudioEye Inc. Common Stock,$23.43,-0.52,-2.171%,251594011.00,United States,,12097,Technology,EDP Services
AEZS,Aeterna Zentaris Inc. Common Stock,$1.03,-0.01,-0.962%,124788399.00,Canada,,982386,,
AFAQU,AF Acquisition Corp. Units,$9.965,0.015,0.151%,0.00,United States,2021,50538,,
AFBI,Affinity Bancshares Inc. Common Stock (MD),$12.475,0.00,0.00%,85769056.00,United States,2017,2,Finance,Major Banks
AFCG,AFC Gamma Inc. Common Stock,$22.46,0.51,2.323%,300220394.00,United States,2021,2562,Consumer Services,Real Estate Investment Trusts
AFIB,Acutus Medical Inc. Common Stock,$12.00,-0.16,-1.316%,337140048.00,United States,2020,32788,Health Care,Biotechnology: Electromedical & Electrotherapeutic Apparatus
AFIN,American Finance Trust Inc. Class A Common Stock,$9.80,-0.14,-1.408%,1066604648.00,United States,,77701,Consumer Services,Real Estate Investment Trusts
AFINO,American Finance Trust Inc. 7.375% Series C Cumulative Redeemable Preferred Stock,$25.61,0.07,0.274%,,United States,,2444,Consumer Services,Real Estate Investment Trusts
AFINP,American Finance Trust Inc. 7.50% Series A Cumulative Redeemable Perpetual Preferred Stock,$25.8701,-0.0799,-0.308%,0.00,United States,,1713,Consumer Services,Real Estate Investment Trusts
AFMD,Affimed N.V.,$10.59,0.03,0.284%,1259713117.00,Germany,2014,352134,Health Care,Major Pharmaceuticals
AFRM,Affirm Holdings Inc. Class A Common Stock,$60.965,-1.205,-1.938%,15692845250.00,United States,2021,936849,Technology,EDP Services
AFYA,Afya Limited Class A Common Shares,$21.49,0.31,1.464%,2002928666.00,Brazil,2019,176638,Consumer Services,Other Consumer Services
AGBA,AGBA Acquisition Limited Ordinary Share,$10.57,-0.0001,-0.001%,56423823.00,Hong Kong,2019,2904,Finance,Business Services
AGBAR,AGBA Acquisition Limited Right,$0.354,0.0239,7.24%,0.00,Hong Kong,2019,1540,Finance,Business Services
AGBAW,AGBA Acquisition Limited Warrant,$0.2501,-0.0199,-7.37%,0.00,Hong Kong,2019,2001,Finance,Business Services
AGC,Altimeter Growth Corp. Class A Ordinary Shares,$12.59,-0.41,-3.154%,786875000.00,United States,2020,194692,Finance,Business Services
AGCUU,Altimeter Growth Corp. Unit,$13.35,-0.28,-2.054%,0.00,United States,2020,20151,Finance,Business Services
AGCWW,Altimeter Growth Corp. Warrant,$3.58,-0.09,-2.452%,0.00,United States,2020,16268,Finance,Business Services
AGEN,Agenus Inc. Common Stock,$3.0599,0.0999,3.375%,626316923.00,United States,2000,396617,Health Care,Biotechnology: Biological Products (No Diagnostic Substances)
AGFS,AgroFresh Solutions Inc. Common Stock,$2.0699,-0.0601,-2.822%,108547175.00,United States,2014,44877,,
AGFY,Agrify Corporation Common Stock,$9.58,0.18,1.915%,194427384.00,United States,2021,63865,Finance,Diversified Commercial Services
AGGRU,Agile Growth Corp. Units,$9.93,0.00,0.00%,0.00,United States,2021,1,Finance,Business Services
AGGRW,Agile Growth Corp. Warrant.,$0.6999,0.6999,,0.00,United States,2021,10200,Finance,Business Services
AGIO,Agios Pharmaceuticals Inc. Common Stock,$53.30,-0.26,-0.485%,3727674453.00,United States,2013,267057,Health Care,Major Pharmaceuticals
AGLE,Aeglea BioTherapeutics Inc. Common Stock,$7.51,-0.10,-1.314%,368144150.00,United States,2016,24747,Health Care,Major Pharmaceuticals
AGMH,AGM Group Holdings Inc. Class A Ordinary Shares,$12.30,0.00,0.00%,355359977.00,Hong Kong,2018,61,Technology,EDP Services
AGNC,AGNC Investment Corp. Common Stock,$17.96,0.07,0.391%,9427204000.00,United States,2008,1399794,Consumer Services,Real Estate Investment Trusts
AGNCM,AGNC Investment Corp. Depositary Shares rep 6.875% Series D Fixed-to-Floating Cumulative Redeemable Preferred Stock,$25.76,-0.10,-0.387%,0.00,United States,,451,Consumer Services,Real Estate Investment Trusts
AGNCN,AGNC Investment Corp. Depositary Shares Each Representing a 1/1000th Interest in a Share of 7.00% Series C Fixed-To-Floating Rate Cumulative Redeemable Preferred Stock,$25.8268,0.0768,0.298%,0.00,United States,,627,Consumer Services,Real Estate Investment Trusts
AGNCO,AGNC Investment Corp. Depositary Shares each representing a 1/1000th interest in a share of 6.50% Series E Fixed-to-Floating Cumulative Redeemable Preferred Stock,$25.19,-0.06,-0.238%,0.00,United States,,4389,Consumer Services,Real Estate Investment Trusts
AGNCP,AGNC Investment Corp. Depositary Shares Each Representing a 1/1000th Interest in a Share of 6.125% Series F Fixed-to-Floating Rate Cumulative Redeemable Preferred Stock,$24.38,-0.07,-0.286%,0.00,United States,,4751,Consumer Services,Real Estate Investment Trusts
AGRX,Agile Therapeutics Inc. Common Stock,$1.535,-0.18,-10.496%,135484842.00,United States,2014,1464836,Health Care,Major Pharmaceuticals
AGTC,Applied Genetic Technologies Corporation Common Stock,$3.995,0.115,2.964%,170795722.00,United States,2014,400724,Health Care,Biotechnology: Biological Products (No Diagnostic Substances)
AGYS,Agilysys Inc. Common Stock,$50.16,0.38,0.763%,1185659608.00,United States,,5707,Technology,Computer Software: Prepackaged Software
AHAC,Alpha Healthcare Acquisition Corp. Class A Common Stock,$10.0282,-0.0018,-0.018%,128912511.00,United States,2020,16103,,
AHACU,Alpha Healthcare Acquisition Corp. Unit,$11.00,-0.10,-0.901%,0.00,United States,2020,226,,
AHACW,Alpha Healthcare Acquisition Corp. Warrant,$2.35,0.00,0.00%,0.00,United States,2020,163,Finance,Business Services
AHCO,AdaptHealth Corp. Class A Common Stock,$28.6595,-0.0505,-0.176%,3292930838.00,United States,2018,156571,Health Care,Biotechnology: Electromedical & Electrotherapeutic Apparatus
AHPI,Allied Healthcare Products Inc. Common Stock,$4.6846,-0.0054,-0.115%,18801815.00,United States,1992,37783,Health Care,Industrial Specialties
AIH,Aesthetic Medical International Holdings Group Ltd. American Depositary Shares,$6.29,-0.03,-0.475%,148525078.00,China,2019,80788,Health Care,Medical Specialities
AIHS,Senmiao Technology Limited Common Stock,$1.175,-0.025,-2.083%,50946611.00,China,2018,89102,Finance,Finance: Consumer Services
AIKI,AIkido Pharma Inc. Common Stock,$0.9512,0.0045,0.475%,84567526.00,United States,,605199,Consumer Durables,Specialty Chemicals
AIMC,Altra Industrial Motion Corp. Common Stock,$62.355,-0.525,-0.835%,4040015494.00,United States,2006,45992,Capital Goods,Industrial Machinery/Components
AINV,Apollo Investment Corporation Common Stock,$14.52,0.11,0.763%,947563236.00,United States,2004,51151,Finance,Finance/Investors Services
AIRG,Airgain Inc. Common Stock,$22.752,-0.228,-0.992%,235525814.00,United States,2016,12636,Technology,Radio And Television Broadcasting And Communications Equipment
AIRT,Air T Inc. Common Stock,$23.30,0.1399,0.604%,67147175.00,United States,,5264,Transportation,Air Freight/Delivery Services
AIRTP,Air T Inc. Air T Funding Alpha Income Trust Preferred Securities,$26.30,0.68,2.654%,0.00,United States,,1010,Transportation,Air Freight/Delivery Services
AIRTW,Air T Inc. Air T Funding Warrants to Purchase Alpha Income Trust Preferred Expiring 08/30/2021,$0.1451,-0.0199,-12.061%,0.00,United States,,2029,Transportation,Air Freight/Delivery Services
AKAM,Akamai Technologies Inc. Common Stock,$109.29,4.10,3.898%,17842913598.00,United States,1999,1046982,Miscellaneous,Business Services
AKBA,Akebia Therapeutics Inc. Common Stock,$3.125,0.165,5.574%,499711603.00,United States,2014,1121118,Health Care,Major Pharmaceuticals
AKIC,Sports Ventures Acquisition Corp. Class A Ordinary Shares,$9.80,0.00,0.00%,288218000.00,United States,2021,3,Finance,Business Services
AKICU,Sports Ventures Acquisition Corp. Unit,$9.99,0.00,0.00%,0.00,United States,2021,306,Finance,Business Services
AKICW,Sports Ventures Acquisition Corp. Warrant,$0.87,-0.03,-3.333%,0.00,United States,2021,180,Finance,Business Services
AKRO,Akero Therapeutics Inc. Common Stock,$28.60,-0.66,-2.256%,995861123.00,United States,2019,63350,Health Care,Major Pharmaceuticals
AKTS,Akoustis Technologies Inc. Common Stock,$9.69,0.08,0.832%,457787325.00,United States,,112898,Public Utilities,Telecommunications Equipment
AKTX,Akari Therapeutics plc ADR (0.01 USD),$2.01,0.06,3.077%,77331371.00,United Kingdom,,113463,Health Care,Major Pharmaceuticals
AKU,Akumin Inc. Common Shares,$2.96,-0.01,-0.337%,207728147.00,Canada,,2467,,
AKUS,Akouos Inc. Common Stock,$13.275,-0.295,-2.174%,456686855.00,United States,2020,29037,Consumer Durables,Specialty Chemicals
AKYA,Akoya BioSciences Inc. Common Stock,$21.08,0.04,0.19%,773137332.00,United States,2021,6056,Capital Goods,Medical Specialities
ALAC,Alberton Acquisition Corporation Ordinary Shares,$11.09,-0.06,-0.538%,51182989.00,Hong Kong,2018,1362,Finance,Business Services
ALACR,Alberton Acquisition Corporation Rights exp April 26 2021,$0.4699,0.00,0.00%,0.00,Hong Kong,2018,14,,
ALACW,Alberton Acquisition Corporation Warrant,$0.4375,0.0275,6.707%,0.00,Hong Kong,2018,10041,,
ALBO,Albireo Pharma Inc. Common Stock,$30.96,0.59,1.943%,591757149.00,United States,,32028,Health Care,Major Pharmaceuticals
ALCO,Alico Inc. Common Stock,$32.40,1.76,5.744%,243434581.00,United States,,26630,Consumer Non-Durables,Farming/Seeds/Milling
ALDX,Aldeyra Therapeutics Inc. Common Stock,$12.57,0.58,4.837%,597625717.00,United States,2014,554732,Health Care,Major Pharmaceuticals
ALEC,Alector Inc. Common Stock,$17.45,-0.96,-5.215%,1388748513.00,United States,2019,130569,Health Care,Major Pharmaceuticals
ALF,ALFI Inc. Common Stock,$3.49,0.59,20.345%,38613880.00,United States,2021,1918310,Technology,EDP Services
ALFIW,ALFI Inc. Warrant,$0.418,-0.032,-7.111%,0.00,United States,2021,419278,,
ALGM,Allegro MicroSystems Inc. Common Stock,$25.01,0.90,3.733%,4737737937.00,United States,2020,89756,Technology,Semiconductors
ALGN,Align Technology Inc. Common Stock,$578.73,-3.42,-0.587%,45798137107.00,United States,2001,108256,Health Care,Industrial Specialties
ALGS,Aligos Therapeutics Inc. Common Stock,$26.45,0.49,1.888%,1008888381.00,United States,2020,9458,Health Care,Major Pharmaceuticals
ALGT,Allegiant Travel Company Common Stock,$240.00,9.64,4.185%,3939829680.00,United States,2006,60308,Transportation,Air Freight/Delivery Services
ALHC,Alignment Healthcare Inc. Common Stock,$26.71,-0.42,-1.548%,5002082717.00,United States,2021,27959,Health Care,Medical Specialities
ALIM,Alimera Sciences Inc. Common Stock,$9.75,-0.40,-3.941%,67259761.00,United States,2010,4983,Health Care,Major Pharmaceuticals
ALJJ,ALJ Regional Holdings Inc. Common Stock,$1.40,-0.01,-0.709%,59249467.00,United States,,25546,Miscellaneous,Business Services
ALKS,Alkermes plc Ordinary Shares,$22.17,-0.13,-0.583%,3557219709.00,Ireland,1991,488922,Health Care,Major Pharmaceuticals
ALKT,Alkami Technology Inc. Common Stock,$42.28,-0.22,-0.518%,3553018615.00,United States,2021,11197,Technology,EDP Services
ALLK,Allakos Inc. Common Stock,$105.98,1.71,1.64%,5670929709.00,United States,2018,11062,Health Care,Major Pharmaceuticals
ALLO,Allogene Therapeutics Inc. Common Stock,$29.58,0.19,0.646%,4185153307.00,United States,2018,105907,Health Care,Biotechnology: Biological Products (No Diagnostic Substances)
ALLT,Allot Ltd. Ordinary Shares,$18.21,0.24,1.336%,648699310.00,Israel,2006,31057,Public Utilities,Telecommunications Equipment
ALNA,Allena Pharmaceuticals Inc. Common Stock,$1.2001,0.0001,0.008%,68740979.00,United States,2017,56761,Health Care,Major Pharmaceuticals
ALNY,Alnylam Pharmaceuticals Inc. Common Stock,$130.36,-1.21,-0.92%,15323171414.00,United States,2004,116065,Health Care,Major Pharmaceuticals
ALOT,AstroNova Inc. Common Stock,$15.84,0.01,0.063%,114253556.00,United States,1983,4927,Technology,Computer peripheral equipment
ALPN,Alpine Immune Sciences Inc. Common Stock,$11.66,0.05,0.431%,278465729.00,United States,2015,18074,Health Care,Major Pharmaceuticals
ALRM,Alarm.com Holdings Inc. Common Stock,$85.01,-0.63,-0.736%,4228246847.00,United States,2015,70556,Technology,Computer Software: Prepackaged Software
ALRN,Aileron Therapeutics Inc. Common Stock,$1.19,0.02,1.709%,107350563.00,United States,2017,88052,Health Care,Major Pharmaceuticals
